file_name,uni,wylie,url,dept,grade,char_len,audio_len,path,inf
STT_AB00244_0121_946970_to_952926,ཨ་ལྟ་ཨ་མ་དང་སྒྲོལ་མ་ལས་ཀ་ནས་སླེབས་མ་ཐག་ཡིན་ཙང་མེ་སླང་ཚ་པོ་ཡོད་ན་མ་གཏོགས་ཇ་ཚ་པོ་འཐུང་ཆོག་ཆོག་ཡོད་མ་རེད།  ,a lta a ma dang sgrol ma las ka nas slebs ma thag yin tsang me slang tsha po yod na ma gtogs ja tsha po 'thung chog chog yod ma red/__,https://d38pmlk0v88drf.cloudfront.net/wav16k/STT_AB00244_0121_946970_to_952926.wav,STT_AB,2,104,5.956,wav16k/STT_AB00244_0121_946970_to_952926.wav,ད་ལྟ་ཨ་མ་དང་སྒྲོལ་མ་ལས་ཀ་ནས་སླེབས་མ་ཐག་ཡིན་ཙང་མེ་ལང་ཚ་པོ་ཡོད་ན་མ་གཏོགས་ཇ་ཚ་པོ་འཐུང་ཆོག་ཆོག་ཡོད་མ་རེད།
STT_AB00319_0678_1667141_to_1668745,ཁམས་ཀྱི་ཚོགས་ནི་གང་པོས་བྱས།  ,khams kyi tshogs ni gang pos byas/__,https://d38pmlk0v88drf.cloudfront.net/wav16k/STT_AB00319_0678_1667141_to_1668745.wav,STT_AB,2,29,1.604,wav16k/STT_AB00319_0678_1667141_to_1668745.wav,ཁམས་ཀྱི་ཚོགས་ནི་གང་བོས་བྱེས།
STT_AB00244_0141_1063148_to_1065674,ངས་དོན་མེད་ཀྱི་སེམས་ཁྲལ་ཁྱེར་དགོས་ཡ་མེད་ལ་ ,ngas don med kyi sems khral khyer dgos ya med la _,https://d38pmlk0v88drf.cloudfront.net/wav16k/STT_AB00244_0141_1063148_to_1065674.wav,STT_AB,2,43,2.526,wav16k/STT_AB00244_0141_1063148_to_1065674.wav,ངས་དོན་མེད་ཀྱི་སེམས་ཁྲལ་འཁྱེར་དགོས་ཡ་མེད་ལ།
STT_AB00244_0142_1065964_to_1068404,དགར་ཁོའི་བརྙས་བཅོས་ཀྱང་བཟོད་དགོས་ཡ་མེད།  ,dgar kho'i brnyas bcos kyang bzod dgos ya med/__,https://d38pmlk0v88drf.cloudfront.net/wav16k/STT_AB00244_0142_1065964_to_1068404.wav,STT_AB,2,41,2.44,wav16k/STT_AB00244_0142_1065964_to_1068404.wav,དགའ་ར་ཁོའི་བརྙས་བཅོས་ཡང་ཟེད་དགོས་ཡ་མེད།
STT_AB00244_0135_1025042_to_1029206,ད་ལྟ་སྔོན་ལ་ཡ་བས་ཉལ་ཉལ་ཉལ་བྱས་འབ་བསུ་མ་འདུས་པ་ཆགས་དུས་ ,da lta sngon la ya bas nyal nyal nyal byas 'ab bsu ma 'dus pa chags dus _,https://d38pmlk0v88drf.cloudfront.net/wav16k/STT_AB00244_0135_1025042_to_1029206.wav,STT_AB,2,55,4.164,wav16k/STT_AB00244_0135_1025042_to_1029206.wav,ད་ལྟ་སྔོན་ལ་ཡ་བལ་ཉལ་ཉན་ཉལ་བྱས་འབ་བསུབ་མ་འདུས་པ་ཆགས་དུས་
STT_AB00244_0136_1029479_to_1030588,ཉིན་ལྟར་ཕྱི་པོ་འགོར་གྱིས།  ,nyin ltar phyi po 'gor gyis/__,https://d38pmlk0v88drf.cloudfront.net/wav16k/STT_AB00244_0136_1029479_to_1030588.wav,STT_AB,2,27,1.109,wav16k/STT_AB00244_0136_1029479_to_1030588.wav,ཉིན་ལྟར་ཕྱི་པོ་འགོར་གྱི།
STT_AB00244_0139_1047175_to_1058029,ཉིན་མོའི་གནས་ཚུལ་རེ་རེ་བཞིན་མིག་ལམ་དུ་འཆར་བ་དང་རྣ་ལམ་དུ་ཐོས་ཡོང་བས་ཕུན་ཚོགས་ཀྱི་གཟུགས་བརྙན་དེ་ཇེ་གསལ་དུ་འགྲོ་བ་དང་སེམས་པ་ཇེ་སྐྱོ་དང་ཁོ་ཇེ་དྲན་དུ་གྱུར་ནས་གཉིད་ག་ལ་ཁུག ,nyin mo'i gnas tshul re re bzhin mig lam du 'char ba dang rna lam du thos yong bas phun tshogs kyi gzugs brnyan de je gsal du 'gro ba dang sems pa je skyo dang kho je dran du gyur nas gnyid ga la khug_,https://d38pmlk0v88drf.cloudfront.net/wav16k/STT_AB00244_0139_1047175_to_1058029.wav,STT_AB,2,166,10.854,wav16k/STT_AB00244_0139_1047175_to_1058029.wav,ཉིན་མོའི་གནས་ཚུལ་རེ་རེ་བཞིན་མིག་ལམ་དུ་འཆར་བ་དང་སྣ་ལམ་དུ་ཐོས་ཡོང་བས་ཕུན་ཚོགས་ཀྱི་གཟུགས་བརྙན་དེ་ཇེ་གསལ་དུ་འགྲོ་བ་དང་སེམས་པ་བྱེད་རྒྱུ་དང་ཁོ་ཇེ་དྲན་དུ་གྱུར་ནས་གཉིད་ག་ལ་ཁུག
STT_AB00244_0144_1075435_to_1082312,ཡིན་ནས་ལས་ད་ལྟ་ནི་ལོ་གཉིས་ཙམ་ལས་ཕྱིན་མེད་ཙང་ག་དུས་ཡང་བསྐྱར་ཐུག་བྱས་ཁྱིམ་ཚང་གཅིག་གི་ནང་འཚོ་བ་སྐྱེལ་རྒྱུ་ཡོང་གི་རེད།  ,yin nas las da lta ni lo gnyis tsam las phyin med tsang ga dus yang bskyar thug byas khyim tshang gcig gi nang 'tsho ba skyel rgyu yong gi red/__,https://d38pmlk0v88drf.cloudfront.net/wav16k/STT_AB00244_0144_1075435_to_1082312.wav,STT_AB,2,116,6.877,wav16k/STT_AB00244_0144_1075435_to_1082312.wav,ཡིན་ནས་ལས་ད་ལྟ་ནི་ལོ་གཉིས་ཙམ་ལས་ཕྱིན་མེད་ཙང་ག་དུས་ཡང་བསྐྱར་ཐུག་བྱས་ཁྱིམ་ཚང་གཅིག་ནང་འཚོ་བ་སྐྱེལ་རྒྱུ་ཡོང་གི་རེད།
STT_AB00244_0145_1083660_to_1091015,དེའི་ཁར་ཉེ་ཆར་ཕུན་ཚོགས་ཀྱི་ཡི་གེ་ཡང་མ་འབྱོར་བར་ཡུན་རིང་སོང་བས་དེ་བས་སྐྱོ་སྣང་དང་སེམས་སྡུག་གིས་མིག་ཆུ་རང་དབང་མེད་པར་ཤོར།  ,de'i khar nye char phun tshogs kyi yi ge yang ma 'byor bar yun ring song bas de bas skyo snang dang sems sdug gis mig chu rang dbang med par shor/__,https://d38pmlk0v88drf.cloudfront.net/wav16k/STT_AB00244_0145_1083660_to_1091015.wav,STT_AB,2,121,7.355,wav16k/STT_AB00244_0145_1083660_to_1091015.wav,དེའི་ཁར་ཉེ་ཆར་ཕུན་ཚོགས་ཀྱི་ཡི་གེ་ཡང་མ་འབྱོར་བར་ཡུན་རིང་སོང་བས་དེ་བས་སྐྱོ་སྣང་དང་སེམས་སྡུག་གིས་མིག་ཆུ་རང་དབང་མེད་པར་ཤོར།
STT_AB00319_0684_1681049_to_1683762,ཅིའི་ཕྱིར་མདོ་སྡེ་པ་ཞེས་བྱ་ཞེ་ན།  ,ci'i phyir mdo sde pa zhes bya zhe na/__,https://d38pmlk0v88drf.cloudfront.net/wav16k/STT_AB00319_0684_1681049_to_1683762.wav,STT_AB,2,34,2.713,wav16k/STT_AB00319_0684_1681049_to_1683762.wav,ཅིའི་ཕྱིར་མདོ་སྡེ་པ་ཞེས་བྱ་ཞེ་ན།
STT_AB00319_0676_1661715_to_1663609,གདགས་པའི་བསྟན་བཅོས་མོའུ་འགལ་བུས།  ,gdags pa'i bstan bcos mo'u 'gal bus/__,https://d38pmlk0v88drf.cloudfront.net/wav16k/STT_AB00319_0676_1661715_to_1663609.wav,STT_AB,2,34,1.894,wav16k/STT_AB00319_0676_1661715_to_1663609.wav,གདགས་པའི་བསྟན་བཅོས་མོའུ་འགལ་བུས།
STT_AB00244_0066_568762_to_579206,སྒྲོལ་མས་སྐད་ཆ་དེ་དག་ཐོས་རྗེས་ལམ་སང་ངོ་གདོང་དམར་པོར་གྱུར་པ་དང་རྣ་ཅོག་གཉིས་ཀྱང་དམར་པོ་ཆགས་པས་རྣ་ཅོག་ལ་བཏགས་པའི་མུ་ཏིག་རྡོག་པོ་ཆུང་ཆུང་གསུམ་པོ་དེའང་དེ་བས་མངོན་གསལ་དོན་དུ་ཕྱིན།  ,sgrol mas skad cha de dag thos rjes lam sang ngo gdong dmar por gyur pa dang rna cog gnyis kyang dmar po chags pas rna cog la btags pa'i mu tig rdog po chung chung gsum po de'ang de bas mngon gsal don du phyin/__,https://d38pmlk0v88drf.cloudfront.net/wav16k/STT_AB00244_0066_568762_to_579206.wav,STT_AB,2,175,10.444,wav16k/STT_AB00244_0066_568762_to_579206.wav,སྒྲོལ་མས་སྐད་ཆ་དེ་དག་ཐོས་རྗེས་ལམ་སེང་ངོ་གདོང་དམར་པོར་གྱུར་བ་དང་། རྣ་ཅོག་གཉིས་ཀྱང་དམར་པོ་ཆགས་པས་རྣ་ཅོག་ལ་བཏགས་པའི་མུ་ཏིག་རྡོག་པོ་ཆུང་ཆུང་གསུམ་པོ་དེ་ཡང་དེ་བས་མངོན་གསལ་དོད་དུ་ཕྱིན།
STT_AB00244_0067_580708_to_586424,སྒྲོལ་མའི་མིག་ཆེན་པོ་གཉིས་ཀྱིས་གྱེན་དུ་ཚེ་བརྟན་ལྷ་མོའི་གདོང་ལ་ལྟ་ཙམ་བྱས་པ་དང་དེ་ནས་ཤོད་མི་བདེ་བའི་ངང་།  ,sgrol ma'i mig chen po gnyis kyis gyen du tshe brtan lha mo'i gdong la lta tsam byas pa dang de nas shod mi bde ba'i ngang /__,https://d38pmlk0v88drf.cloudfront.net/wav16k/STT_AB00244_0067_580708_to_586424.wav,STT_AB,2,104,5.716,wav16k/STT_AB00244_0067_580708_to_586424.wav,སྒྲོལ་མའི་མིག་ཆེན་པོ་གཉིས་ཀྱིས་གྱེན་དུ་ཚེ་བརྟན་ལྷ་མོའི་གདོང་ལ་ལྟ་ཙམ་བྱས་པ་དང་། དེ་ནས་ཤོད་མི་བདེ་བའི་ངང་
STT_AB00243_0194_1535930_to_1539172,ད་ནི་རྒྱུ་ནོར་ཡོངས་རྫོགས་ཐུན་མོང་ལ་སྤུངས་རྒྱུ་རེད་ཅེས་སྨྲས་པས།  ,da ni rgyu nor yongs rdzogs thun mong la spungs rgyu red ces smras pas/__,https://d38pmlk0v88drf.cloudfront.net/wav16k/STT_AB00243_0194_1535930_to_1539172.wav,STT_AB,2,64,3.242,wav16k/STT_AB00243_0194_1535930_to_1539172.wav,ད་ནི་རྒྱུ་ནོར་ཡོངས་རྫོགས་ཐུན་མོང་ལ་ཡ་སྤོང་རྒྱུ་རེད་ཅེས་སྨྲས་པས་
STT_AB00243_0195_1540230_to_1543831,ཁོང་ཚོ་དེ་བས་ཧ་ལས། རྨོ་བོ་བདེ་སྒྲོན་གྱིས་མ་མོས་པའི་ངང་ ,khong tsho de bas ha las/_rmo bo bde sgron gyis ma mos pa'i ngang _,https://d38pmlk0v88drf.cloudfront.net/wav16k/STT_AB00243_0195_1540230_to_1543831.wav,STT_AB,2,55,3.601,wav16k/STT_AB00243_0195_1540230_to_1543831.wav,ཁོ་ཚོ་དེ་བས་ཧ་ལས་ རྨོ་བོ་བདེ་སྒྲོན་གྱིས་མ་བོས་པའི་ངང་
STT_AB00244_0065_558182_to_567670,ནང་ལ་མི་བྱེད་མང་པོ་ཡོད་ནས་ལས་ཕ་མ་གཉིས་ཀ་ཡོད་རེད། མི་དེ་ནི་ལས་ཀ་འཇོན་པ་དང་མི་ལ་བསྟུན་མཁས་པོ་ཡོད་ཙང་ཁྱོད་གཉིས་འགྲིག་ཐུབ་ན་ཡག་པོ་ཡོད་རེད་བསམ་གྱི་ཞེས་བཤད།  ,nang la mi byed mang po yod nas las pha ma gnyis ka yod red/_mi de ni las ka 'jon pa dang mi la bstun mkhas po yod tsang khyod gnyis 'grig thub na yag po yod red bsam gyi zhes bshad/__,https://d38pmlk0v88drf.cloudfront.net/wav16k/STT_AB00244_0065_558182_to_567670.wav,STT_AB,2,152,9.488,wav16k/STT_AB00244_0065_558182_to_567670.wav,ནང་ལ་མི་བྱེ་མང་པོ་ཡོད་ནས་ལས་ཕ་མ་གཉིས་ཀ་ཡོད་རེད། མི་དེ་ནི་ལས་ཀ་འཇོན་པ་དང་མི་ལ་བསྟུན་མཁས་པོ་ཡོད་ཙང་ཁྱེད་གཉིས་སྒྲིག་ཐུབ་ན་ཡག་པོ་ཡོད་རེད་བསམ་གྱི་ཞེས་བཤད།
STT_AB00244_0068_587141_to_589940,མི་གཞན་དག་གིས་མི་ཁ་ཟུག་གི་ཡོད་པ་རེད།  ,mi gzhan dag gis mi kha zug gi yod pa red/__,https://d38pmlk0v88drf.cloudfront.net/wav16k/STT_AB00244_0068_587141_to_589940.wav,STT_AB,2,38,2.799,wav16k/STT_AB00244_0068_587141_to_589940.wav,མི་གཞན་དག་གིས་མི་དགེ་བཟོ་གི་ཡོད་པ་རེད།
STT_AB00244_0069_591203_to_593540,ང་རེས་བལྟས་ནས་ལས་སྤེན་པ་བློ་ལ་འབབ་ཀྱི་འདུག ,nga res bltas nas las spen pa blo la 'bab kyi 'dug_,https://d38pmlk0v88drf.cloudfront.net/wav16k/STT_AB00244_0069_591203_to_593540.wav,STT_AB,2,43,2.337,wav16k/STT_AB00244_0069_591203_to_593540.wav,ང་རས་བལྟས་ནས་ལས་སྤེན་པ་བློ་ལ་འབབས་ཀྱི་འདུག
STT_AB00244_0071_603677_to_609206,དེ་དུས་མི་ཚོས་རང་ལ་ཡ་སེམས་སྟོན་གྱི་ཡོད་པའི་རྟགས་རེད་ཅེས་རང་གི་མྱོང་བ་ཕྱོགས་བསྡོམས་བྱས་ནས་བཤད།  ,de dus mi tshos rang la ya sems ston gyi yod pa'i rtags red ces rang gi myong ba phyogs bsdoms byas nas bshad/__,https://d38pmlk0v88drf.cloudfront.net/wav16k/STT_AB00244_0071_603677_to_609206.wav,STT_AB,2,95,5.529,wav16k/STT_AB00244_0071_603677_to_609206.wav,དེ་དུས་མི་ཚོས་རང་ལ་ཡ་སེམས་བརྟེན་གི་ཡོད་པའི་རྟགས་རེད་ཅེས་རང་གིས་མྱོང་བ་ཕྱོགས་བསྡོམས་བྱས་ནས་བཤད།
STT_AB00319_0683_1677261_to_1680042,འགྲོ་བའི་རྣམ་གྲངས་ཤཱ་རིའི་བུས་བྱས་པར་འཆད་དོ།  ,'gro ba'i rnam grangs shA ri'i bus byas par 'chad do/__,https://d38pmlk0v88drf.cloudfront.net/wav16k/STT_AB00319_0683_1677261_to_1680042.wav,STT_AB,2,46,2.781,wav16k/STT_AB00319_0683_1677261_to_1680042.wav,འགྲོ་བའི་རྣམ་གྲངས་ཤཱ་རིའི་བུས་བྱེད་པར་འཆད་དོ།
STT_AB00242_0144_1006271_to_1016058,གཞན་ལ་སྨོན་མ་དགོས་ཙམ་ཡོད་ལ་དེ་ཁར་ད་དུང་མོའི་ཁྱིམ་ཚང་གི་ཆ་རྐྱེན་ཡག་པོ་ཡོད་པས་གཞོན་ནུ་གཉིས་གསུམ་གྱིས་མོ་ལ་རེ་བ་བྱེད་ཀྱི་ཡོད་ནའང་མོས་ ,gzhan la smon ma dgos tsam yod la de khar da dung mo'i khyim tshang gi cha rkyen yag po yod pas gzhon nu gnyis gsum gyis mo la re ba byed kyi yod na'ang mos _,https://d38pmlk0v88drf.cloudfront.net/wav16k/STT_AB00242_0144_1006271_to_1016058.wav,STT_AB,2,131,9.787,wav16k/STT_AB00242_0144_1006271_to_1016058.wav,གཞན་ལ་སྨོས་མ་དགོས་ཙམ་ཡོད་ལ། དེའ་ཁར་ད་དུང་མོའི་ཁྱིམ་ཚང་གི་ཆ་རྐྱེན་ཡག་པོ་ཡོད་པས་གཞོན་ནུ་གཉིས་གསུམ་གྱིས་མོ་ལ་རེ་བ་བྱེད་ཀྱི་ཡོད་ན་ཡང་མོས་ད་
STT_AB00244_0175_1311902_to_1320469,འོན་ཀྱང་གཡང་གཟར་བྲག་རིའི་ལྡེབས་སུ་སྐྱེས་པའི་ཤུག་པ་དང་དེ་བཞིན་གཡའ་དང་སྤང་གི་མཚམས་སུ་སྐྱེས་པའི་སྤ་མ་དེ་དག་གི་མདོག་ ,'on kyang g.yang gzar brag ri'i ldebs su skyes pa'i shug pa dang de bzhin g.ya' dang spang gi mtshams su skyes pa'i spa ma de dag gi mdog _,https://d38pmlk0v88drf.cloudfront.net/wav16k/STT_AB00244_0175_1311902_to_1320469.wav,STT_AB,2,113,8.567,wav16k/STT_AB00244_0175_1311902_to_1320469.wav,འོན་ཀྱང་གཡང་གསར་བྲག་རིལ་ལྡེབས་སུ་སྐྱེས་པའི་ཤུག་པ་དང་། དེ་བཞིན་གཡའ་དང་སྤང་གི་མཚམས་སུ་སྐྱེས་པའི་པ་མ་དེ་དག་གི་མདོག་
STT_AB00244_0169_1258080_to_1270597,ད་ཆ་ཕུན་ཚོགས་ལྷ་སར་སློབ་སྦྱོང་དུ་སོང་ནས་བསྡད་མེད་པ་དང་རང་ཉིད་ཀྱི་གནས་བབ་ཀྱང་ཇེ་མཐོར་འགྲོ་བའི་སྐབས་དེར་ཁོའི་ནད་རྙིང་པ་དེ་ལངས་ནས་ཚེ་བརྟན་ལྷ་མོ་རང་ཉིད་ལ་དབང་བ་བྱེད་རྒྱུ་བྱུང་ན་ཅི་མ་རུང་སྙམ་ནས་ཐ་ནས་ ,da cha phun tshogs lha sar slob sbyong du song nas bsdad med pa dang rang nyid kyi gnas bab kyang je mthor 'gro ba'i skabs der kho'i nad rnying pa de langs nas tshe brtan lha mo rang nyid la dbang ba byed rgyu byung na ci ma rung snyam nas tha nas _,https://d38pmlk0v88drf.cloudfront.net/wav16k/STT_AB00244_0169_1258080_to_1270597.wav,STT_AB,2,195,12.517,wav16k/STT_AB00244_0169_1258080_to_1270597.wav,ད་ཆ་ཕུན་ཚོགས་ལྷ་སར་སློབ་སྦྱོང་དུ་སོང་ནས་བསྡད་མེད་པ་དང་རང་ཉིད་ཀྱི་གནས་བབ་ཀྱང་ཇེ་མཐོར་འགྲོ་བའི་སྐབས་དེར་ཁོའི་ནད་རྙིང་པ་དེ་ལངས་ནས་ཚེ་བརྟན་ལྷ་མོ་རང་ཉིད་ལ་དབང་རྒྱུ་བྱུང་ན་ཅི་མ་རུང་སྙམ་ནས་ཐ་ན་
STT_AB00242_0141_978011_to_986066,ཚེ་བརྟན་ལྷ་མོ་ནི་ཆུང་དུས་གོམས་གཤིས་གྲུབ་པའི་དབང་གིས་རྣམ་ཀུན་ཕྱི་ལ་དོན་ཧ་ཅང་ཉུང་ཉུང་ཡིན་ཞིང་ཀླུ་གཤགས་རྒྱག་རྒྱུར་དེ་བས་དགའ་པོ་མེད་མོད།  ,tshe brtan lha mo ni chung dus goms gshis grub pa'i dbang gis rnam kun phyi la don ha cang nyung nyung yin zhing klu gshags rgyag rgyur de bas dga' po med mod/__,https://d38pmlk0v88drf.cloudfront.net/wav16k/STT_AB00242_0141_978011_to_986066.wav,STT_AB,2,134,8.055,wav16k/STT_AB00242_0141_978011_to_986066.wav,ཚེ་བརྟན་ལྷ་མོ་ནི་ཆུང་དུས་གོམས་གཤིས་གྲུབ་པའི་དབང་གིས་རྣམ་ཀུན་ཕྱི་ལ་དོན་ཧ་ཅང་ཉུང་ཉུང་ཡིན་ཞིང་གླུ་བཞག་རྒྱག་རྒྱུར་དེ་བས་དགའ་པོ་མེད་མོད།
STT_AB00242_0142_986697_to_996484,མོའི་གྲོགས་མོ་འཛོམས་སྐྱིད་ནི་སེམས་པ་གུ་ཡངས་ཤིང་ཧ་ཧ་ཧུ་ཧུའི་འཚོ་བ་དང་རྩེད་མོ་དང་གླུ་གཤགས་ལ་ཧ་ཅང་དགའ་བ་དང་བུ་མོའི་ཕྱོགས་ཀྱི་གཙོ་བོ་ཞིག་ཡིན་པས་སྤྱིར་ན་ ,mo'i grogs mo 'dzoms skyid ni sems pa gu yangs shing ha ha hu hu'i 'tsho ba dang rtsed mo dang glu gshags la ha cang dga' ba dang bu mo'i phyogs kyi gtso bo zhig yin pas spyir na _,https://d38pmlk0v88drf.cloudfront.net/wav16k/STT_AB00242_0142_986697_to_996484.wav,STT_AB,2,149,9.787,wav16k/STT_AB00242_0142_986697_to_996484.wav,མོའི་གྲོགས་མོ་འཛོམས་སྐྱིད་ནི་སེམས་པ་གུ་ཡངས་ཤིང་ཧ་ཧ་ཧུ་ཧུའ་འཚོ་བ་དང་རྩེད་མོ་དང་གླུ་ཞག་ལ་ཧ་ཅང་དགའ་བ་དང་བུ་མོའི་ཕྱོགས་ཀྱི་གཙོ་བོ་ཞིག་ཡིན་པས། སྤྱེར་ན་
STT_AB00242_0143_996484_to_1006271,ཉིན་ལྟར་ཕྱི་དྲོ་ལས་ཀ་མེད་པའི་དུས་སུ་དེ་གར་འདུས་ནས་གླེང་མོ་དང་གླུ་གཤགས་རྒྱག་གི་ཡོད། མོ་ཡང་ཡུལ་དེའི་བུ་མོའི་ཁྲོད་དུ་སྐྱེ་གཟུགས་དང་འཇོན་ཐང་གང་ཅིར་ ,nyin ltar phyi dro las ka med pa'i dus su de gar 'dus nas gleng mo dang glu gshags rgyag gi yod/_mo yang yul de'i bu mo'i khrod du skye gzugs dang 'jon thang gang cir _,https://d38pmlk0v88drf.cloudfront.net/wav16k/STT_AB00242_0143_996484_to_1006271.wav,STT_AB,2,144,9.787,wav16k/STT_AB00242_0143_996484_to_1006271.wav,ཉིན་ལྟར་ཕྱི་དྲོ་ལས་ཀ་མེད་པའི་དུས་སུ་དེ་གར་བསྡུས་ནས་གླེང་མོ་དང་གླུ་ཞག་རྒྱག་གི་ཡོད། མོ་ཡང་ཡུལ་དེའི་བུ་མོའི་ཁྲོད་དུ་སྐྱེ་གཟུག་དང་འཇོན་ཐང་གང་ཅིག་
STT_AB00243_0196_1545435_to_1550127,བསོད་ནམས་མེད་པའི་སྒོ་ཐལ་ནང་ལ་ཡ་ཚིལ་ལུ་བརྡུངས་ནས་ཞག་རྩི་འཁོར་གི་མ་རེད།  ,bsod nams med pa'i sgo thal nang la ya tshil lu brdungs nas zhag rtsi 'khor gi ma red/__,https://d38pmlk0v88drf.cloudfront.net/wav16k/STT_AB00243_0196_1545435_to_1550127.wav,STT_AB,2,71,4.692,wav16k/STT_AB00243_0196_1545435_to_1550127.wav,བསོད་ནམས་མེད་པའི་སྒོ་མྟིལ་ནང་ལ་ཡ་ཚི་ལུ་བསྡུག་ནས་ཞག་རྩི་འཁོར་གི་མ་རེད།
STT_AB00243_0197_1550418_to_1551766,དོན་གྲུབ་ཀྱིས་ཤེས་ཀྱི་མ་རེད།  ,don grub kyis shes kyi ma red/__,https://d38pmlk0v88drf.cloudfront.net/wav16k/STT_AB00243_0197_1550418_to_1551766.wav,STT_AB,2,30,1.348,wav16k/STT_AB00243_0197_1550418_to_1551766.wav,དོན་གྲུབ་ཀྱིས་ཤེས་ཀྱི་མ་རེད།
STT_AB00244_0174_1300162_to_1310981,གཡས་གཡོན་གྱི་ཆུ་ཕྲན་དག་ལ་འཁྱགས་པ་མཐུག་ཙམ་ཆགས་ཟིན་པ་དང་ས་ཞིང་རྣམས་ནི་སྐྱ་ཐེར་ཐེར་དུ་གྱུར་བས་དབྱར་གྱི་ཉམས་འགྱུར་ལྟ་བཞག་སྟོན་གྱི་ཉམས་འགྱུར་ལྷག་འཕྲོ་ཙམ་ཡང་གནས་མེད།  ,g.yas g.yon gyi chu phran dag la 'khyags pa mthug tsam chags zin pa dang sa zhing rnams ni skya ther ther du gyur bas dbyar gyi nyams 'gyur lta bzhag ston gyi nyams 'gyur lhag 'phro tsam yang gnas med/__,https://d38pmlk0v88drf.cloudfront.net/wav16k/STT_AB00244_0174_1300162_to_1310981.wav,STT_AB,2,161,10.819,wav16k/STT_AB00244_0174_1300162_to_1310981.wav,གཡས་གཡོན་གྱི་ཆུ་སཕྲིང་དག་ལ་འཁྱག་པ་ཐུག་ཙམ་ཆགས་ཟིན་པ་དང་།ས་ཞིང་རྣམས་ནི་སྐྱ་ཐེལ་ཐེར་དུ་གྱུར་བས་དབྱར་གྱི་ཉམས་འགྱུར་ལྟ་བཞག སྟོན་གྱི་ཉམས་འགྱུར་ལྷག་འྒྲོ་ཙམ་ཡང་གནས་མེད།
STT_AB00244_0176_1320947_to_1323523,ཅུང་འགྱུར་བ་ཙམ་ལས་ད་ལྟའི་ངོས་ནས་བལྟས་ན་ ,cung 'gyur ba tsam las da lta'i ngos nas bltas na _,https://d38pmlk0v88drf.cloudfront.net/wav16k/STT_AB00244_0176_1320947_to_1323523.wav,STT_AB,2,40,2.576,wav16k/STT_AB00244_0176_1320947_to_1323523.wav,ཅུང་ཙམ་གྱུར་བ་ལས་ད་ལྟའི་ངོས་ནས་བལྟས་ན་
