file_name,uni,wylie,url,dept,grade,char_len,audio_len,path,inf
STT_AB00239_0038_331825_to_343216,དང་འཇིགས་སྣང་གིས་ཁེངས། འོན་ཀྱང་ཁོས་དེ་ནི་མི་སྲིད་སྙམ་པའི་རེ་བ་ཞིག་སྐྱེས་ནས་གཡང་འཛོམས་ལགས། ཁྱེད་རང་གིས་དེ་འདྲ་མ་གསུངས་དང་། ཐུགས་ལྷོད་ལྷོད་བྱས་ནད་གཞི་གསོས་ ,dang 'jigs snang gis khengs/_'on kyang khos de ni mi srid snyam pa'i re ba zhig skyes nas g.yang 'dzoms lags/_khyed rang gis de 'dra ma gsungs dang /_thugs lhod lhod byas nad gzhi gsos _,https://d38pmlk0v88drf.cloudfront.net/wav16k/STT_AB00239_0038_331825_to_343216.wav,STT_AB,2,154,11.391,wav16k/STT_AB00239_0038_331825_to_343216.wav,དང་འཇིགས་སྣང་གིས་ཁེངས། འོན་ཀྱང་ཁོས་དེ་ནི་མི་སྲིད་སྙམ་པའི་རེ་བ་ཞིག་སྐྱེས་ནས་གཡང་འཛོམས་ལགས། ཁྱེད་རང་གིས་དེ་འདྲ་མ་གསུངས་དང་། ཐུགས་ལྷོད་ལྷོད་བྱས་ནད་གཞི་གསོས་ན་
STT_AB00239_0035_304547_to_306988,ངས་ནམ་གཞག་ཀུན་ཏུ་སེམས་བཟང་ཁོ་ན་མ་གཏོགས་ ,ngas nam gzhag kun tu sems bzang kho na ma gtogs _,https://d38pmlk0v88drf.cloudfront.net/wav16k/STT_AB00239_0035_304547_to_306988.wav,STT_AB,2,40,2.441,wav16k/STT_AB00239_0035_304547_to_306988.wav,ངས་ནམ་ཞག་ཀུན་ཏུ་སེམས་བཟང་ཁོ་ན་མ་གཏོགས་
STT_AB00239_0036_307534_to_319223,ངན་སེམས་དང་སྡིག་ལས་ག་གས་བྱེད་མྱོང་མེད། ད་རེས་ང་སྔོན་ལ་ཡ་འགྲོ་དགོས་པ་དེ་ནི་ཚེ་སྔོན་མའི་ལས་རེད། བྱས་ཙང་དམྱལ་བ་དང་བར་དོ་ལ་སྐྱེ་མི་སྲིད་པས་བློ་བདེ་པོ་གནང་ཞིག་ཅེས་བརྗོད།  ,ngan sems dang sdig las ga gas byed myong med/_da res nga sngon la ya 'gro dgos pa de ni tshe sngon ma'i las red/_byas tsang dmyal ba dang bar do la skye mi srid pas blo bde po gnang zhig ces brjod/__,https://d38pmlk0v88drf.cloudfront.net/wav16k/STT_AB00239_0036_307534_to_319223.wav,STT_AB,2,166,11.689,wav16k/STT_AB00239_0036_307534_to_319223.wav,ངའི་སེམས་དང་འདི་ལས་ག་གེ་བྱེད་མྱོང་མེད། ད་རེས་ང་སྔོན་ལ་ཡ་འགྲོ་དགོས་པ་དེ་ནི་ཚེ་སྔོན་མའི་ལས་རེད། བྱས་ཙང་དམྱལ་བ་དང་བར་དོར་སྐྱེ་མི་སྲིད་པའི་བློ་བདེ་པོ་གནང་ཞིག་ཅེས་བརྗོད།
STT_AB00239_0037_320435_to_331825,གཡང་འཛོམས་ཀྱིས་དེ་ལྟར་ཤོད་སྐབས་དོན་གྲུབ་ཀྱི་སྣང་བར་གཤིན་རྗེའི་ལས་མཁན་གྱིས་གདུག་རྩུབ་ཆེན་པོས་རང་ཉིད་ཀྱི་བརྩེ་བའི་བཟའ་ཟླ་འཕྲོག་པར་ཡོང་བའི་ཚུལ་རྣམས་དངོས་སུ་མིག་མཐོང་གི་སྣང་བ་བྱུང་བས་སེམས་པ་སྐྱོ་བ་ ,g.yang 'dzoms kyis de ltar shod skabs don grub kyi snang bar gshin rje'i las mkhan gyis gdug rtsub chen pos rang nyid kyi brtse ba'i bza' zla 'phrog par yong ba'i tshul rnams dngos su mig mthong gi snang ba byung bas sems pa skyo ba _,https://d38pmlk0v88drf.cloudfront.net/wav16k/STT_AB00239_0037_320435_to_331825.wav,STT_AB,2,194,11.39,wav16k/STT_AB00239_0037_320435_to_331825.wav,གཡང་འཛོམས་ཀྱིས་དེ་ལྟར་ཤོད་སྐབས་དོན་གྲུབ་ཀྱི་སྣང་བར་གཤིན་རྗེའི་ལས་མཁན་གྱིས་གདུག་རྩུབ་ཆེན་པོས་རང་ཉིད་ཀྱི་བརྩེ་བའི་བཟའ་ཟླ་འཕྲོག་པར་ཡོང་བའི་ཚུལ་རྣམས་དངོས་སུ་མིག་མཐུང་གི་སྣང་བ་བྱུང་བས་སེམས་པ་སྐྱོ་བ་
STT_AB00239_0045_410776_to_418950,འཛམ་བུ་གླིང་ན་ཚང་སྡེ་དཀོན་ཞེས་པ་ལྟར་ལས་དབང་གིས་རྐང་བཙུགས་ནས་ཁོ་ཚོའི་བདེ་སྐྱིད་ལ་ཕྲག་དོག་གིས་ཁོ་ཚོར་མནར་གཅོད་དེ་ལྟ་བུ་ཞིག་བྱེད།  ,'dzam bu gling na tshang sde dkon zhes pa ltar las dbang gis rkang btsugs nas kho tsho'i bde skyid la phrag dog gis kho tshor mnar gcod de lta bu zhig byed/__,https://d38pmlk0v88drf.cloudfront.net/wav16k/STT_AB00239_0045_410776_to_418950.wav,STT_AB,2,128,8.174,wav16k/STT_AB00239_0045_410776_to_418950.wav,འཛམ་བུ་གླིང་ན་ཚང་སྡེ་དཀོན་ཞེས་པ་ལྟར་ལས་དབང་གིས་རྐང་བཙུགས་ནས་ཁོ་ཚོའི་བདེ་སྐྱིད་ལ་ཕྲག་དོག་གིས་ཁོ་ཚོར་མནར་གཅོད་དེ་ལྟ་བུ་ཞིག་བྱས།
STT_AB00239_0046_420025_to_426083,བདེ་སྒྲོན་དང་དོན་གྲུབ་ཀྱིས་སེམས་རྩེ་གཅིག་གིས་མོ་ལུང་གསུང་བརྟག་ཞུས་པ་དང་ ,bde sgron dang don grub kyis sems rtse gcig gis mo lung gsung brtag zhus pa dang _,https://d38pmlk0v88drf.cloudfront.net/wav16k/STT_AB00239_0046_420025_to_426083.wav,STT_AB,2,72,6.058,wav16k/STT_AB00239_0046_420025_to_426083.wav,བདེ་སྒྲོན་དང་དོན་གྲུབ་ཀྱིས་སེམས་རྩེ་གཅིག་གིས་མོ་ལུང་གསུང་རྟགས་ཞུས་པ་དང་
STT_AB00233_0116_1479251_to_1491823,ཡུལ་དབུས་ན་སངས་རྒྱས་པའི་རབ་བྱུང་བཞུགས་པ་མཐོང་ཚུལ་སོགས་བྲིས་པ་འདིས་ཤེས་ལ། བློན་པོ་དེ་དང་ཟླ་བ་སྦས་པའི་དུས་ན་ཅུང་ཟད་ཀྱང་མ་ནོར་བར་བརྩི་ནུས། སྟོན་པ་འདས་ནས་ཉིས་སྟོང་ ,yul dbus na sangs rgyas pa'i rab byung bzhugs pa mthong tshul sogs bris pa 'dis shes la/_blon po de dang zla ba sbas pa'i dus na cung zad kyang ma nor bar brtsi nus/_ston pa 'das nas nyis stong _,https://d38pmlk0v88drf.cloudfront.net/wav16k/STT_AB00233_0116_1479251_to_1491823.wav,STT_AB,2,160,12.572,wav16k/STT_AB00233_0116_1479251_to_1491823.wav,ཡུལ་དབུན་ན་སངས་རྒྱས་པའས་རབ་བྱུང་བཞུགས་པ་མཐོང་ཚུལ་སོགས་དྲིས་པ། འདི་བཤེས་ལ་ བློན་པོ་དེ་དང་ཟླ་བ་སྦས་པའི་དུས་ན་ཅུང་ཟད་ཀྱང་མ་ནོར་བར་རྩིས་ནུས། སྟོན་པ་འདས་ནས་ཉི་ོག
STT_AB00239_0043_389007_to_399695,ལས་ཀ་གང་ཅིར་འཇོན་པོ་ཡོད་པས་བདེ་སྒྲོན་གྱིས་ཧ་ཅང་དགའ་པོ་བྱེད་ཀྱི་ཡོད། ཁོང་གཉིས་འཆམ་པོ་ཡོད་པས་ད་བར་མ་འདོད་པའི་ཚིག་ཟུར་ཙམ་ལབ་རེས་མེད་སྟབས་མི་གཞན་གྱིས་ཁོ་གཉིས་ ,las ka gang cir 'jon po yod pas bde sgron gyis ha cang dga' po byed kyi yod/_khong gnyis 'cham po yod pas da bar ma 'dod pa'i tshig zur tsam lab res med stabs mi gzhan gyis kho gnyis _,https://d38pmlk0v88drf.cloudfront.net/wav16k/STT_AB00239_0043_389007_to_399695.wav,STT_AB,2,155,10.688,wav16k/STT_AB00239_0043_389007_to_399695.wav,ལས་ཀ་གང་ཅིར་འཇོན་པོ་ཡོད་པས་བདེ་སྒྲོན་གྱིས་ཧ་ཅང་དགའ་པོ་བྱེད་ཀྱི་ཡོད། ཁོ་གཉིས་འཆམ་པོ་ཡོད་པས་ད་བར་མ་འདོད་པའི་ཚིག་ཟུར་ཙམ་ལབ་རིམ་མེད་སྟབས་མི་གཞན་གྱིས་ཁོ་གཉིས་
STT_AB00239_0044_399695_to_410383,མནའ་བ་དང་སྨྱུའི་བར་གྱི་འབྲེལ་བའི་དཔེ་སྟོན་དུ་བརྩི་གི་ཡོད། དེས་ན་ཁོ་ཚོའི་ཁྱིམ་ཚང་དེ་ནི་དངོས་གནས་བདེ་སྐྱིད་དྲོ་འཇམ་ལྡན་པའི་ཁྱིམ་ཚང་ཞིག་ཡིན་ནའང་འཇིག་རྟེན་གཏམ་དཔེར་ ,mna' ba dang smyu'i bar gyi 'brel ba'i dpe ston du brtsi gi yod/_des na kho tsho'i khyim tshang de ni dngos gnas bde skyid dro 'jam ldan pa'i khyim tshang zhig yin na'ang 'jig rten gtam dper _,https://d38pmlk0v88drf.cloudfront.net/wav16k/STT_AB00239_0044_399695_to_410383.wav,STT_AB,2,161,10.688,wav16k/STT_AB00239_0044_399695_to_410383.wav,མནའ་མ་དང་མྒྱུགས་མོའི་བར་གྱི་འབྲེལ་བའི་དཔེ་དོན་དུ་བརྩི་གྱི་ཡོད། དེས་ན་ཁོ་ཚོའི་ཁྱིམ་ཚང་དེ་ནི་དངོས་གནས་བདེ་སྐྱིད་དྲོ་འཆམ་ལྡན་པའི་ཁྱིམ་ཚང་ཞིག་ཡིན་ན་ཡང་འཇིག་རྟེན་གཏམ་དཔེར་
STT_AB00242_0044_269923_to_271168,འགག་ཅ་ད་ག་ཐུག་ཡོད་རེད།  ,'gag ca da ga thug yod red/__,https://d38pmlk0v88drf.cloudfront.net/wav16k/STT_AB00242_0044_269923_to_271168.wav,STT_AB,2,24,1.245,wav16k/STT_AB00242_0044_269923_to_271168.wav,འགག་བྱ་ད་ག་ཐུག་ཡོད་རེད།
STT_AB00239_0061_562448_to_569957,དེའི་ཆར་ཁོའི་བློ་ཕུགས་བཅོལ་ས་ནི་ཚེ་བརྟན་ལྷ་མོ་ལས་མེད་པ་དང་བྱམས་ཀྱིས་སྐྱོང་ས་ནི་ཨ་མ་དང་བུ་མོ་གཉིས་ལས་མེད་པས་བསམ་ ,de'i char kho'i blo phugs bcol sa ni tshe brtan lha mo las med pa dang byams kyis skyong sa ni a ma dang bu mo gnyis las med pas bsam _,https://d38pmlk0v88drf.cloudfront.net/wav16k/STT_AB00239_0061_562448_to_569957.wav,STT_AB,2,112,7.509,wav16k/STT_AB00239_0061_562448_to_569957.wav,དེའི་ཆར་ཁོའི་བློ་ཕུག་བཅོལ་ས་ནི་ཚེ་བརྟན་ལྷ་མོ་ལས་མེད་པ་དང་བྱམས་ཀྱི་སྐྱོང་ས་ནི་ཨ་མ་དང་བུ་མོ་གཉིས་ལས་མེད་པས་ས་
STT_AB00239_0065_593694_to_604394,ནམ་མཁར་སྤྲིན་པ་རིམ་བཞིན་ཉུང་དུ་འགྲོ་བ་དེ་དག་ཀྱང་བལ་ལྟར་དཀར་ལ་ཟླུམ་རིལ་གྱི་དབྱིབས་སུ་གྲུབ། སྔོ་ཐིང་ཐིང་གི་ནམ་མཁའ་དེའང་རིམ་བཞིན་མཐོ་རུ་འགྲོ་བའི་སྣང་བ་བྱུང་།  ,nam mkhar sprin pa rim bzhin nyung du 'gro ba de dag kyang bal ltar dkar la zlum ril gyi dbyibs su grub/_sngo thing thing gi nam mkha' de'ang rim bzhin mtho ru 'gro ba'i snang ba byung /__,https://d38pmlk0v88drf.cloudfront.net/wav16k/STT_AB00239_0065_593694_to_604394.wav,STT_AB,2,156,10.7,wav16k/STT_AB00239_0065_593694_to_604394.wav,ནམ་མཁར་སྤྲིན་པ་རིམ་བཞིན་ཉུང་དུ་འགྲོ་བ་དེ་དག་ཀྱང་བལ་ལྟར་དཀར་ལ་ལྡུམ་རིལ་གྱི་དབྱིབས་སུ་གྲུབ། སྔོ་ཐིང་ཐིང་གི་ནམ་མཁའ་དེ་ཡང་རིམ་བཞིན་མཐོ་རུ་འགྲོ་བའི་སྣང་བ་བྱུང་།
STT_AB00239_0062_569957_to_577465,བློའི་ནང་ག་དུས་ཡིན་ནས་ཁོ་གཉིས་ལ་ལྟ་རྟོགས་དང་བྱམས་སེམས་བྱེད་རྒྱུ་ལས་དེ་མིན་གྱི་བྱ་དངོས་གང་ཞིག་གི་འགན་འཁྲིའང་མེད་པ་ལྟ་བུར་གྱུར་རོ།  ,blo'i nang ga dus yin nas kho gnyis la lta rtogs dang byams sems byed rgyu las de min gyi bya dngos gang zhig gi 'gan 'khri'ang med pa lta bur gyur ro/__,https://d38pmlk0v88drf.cloudfront.net/wav16k/STT_AB00239_0062_569957_to_577465.wav,STT_AB,2,130,7.508,wav16k/STT_AB00239_0062_569957_to_577465.wav,གསམ་བློའི་ནང་ག་དུས་ཡིན་ནས་ཁོ་གཉིས་ལ་ལྟ་རྟོག་དང་བྱམས་སེམས་བྱེད་རྒྱུ་ལས་དེ་མིན་གྱི་བྱ་དངོས་གང་ཞིག་གི་འགན་འཁྲི་ཡང་མེད་པ་ལྟ་བུར་གྱུར་རོ།
STT_AB00239_0063_578984_to_585844,དུས་ཚོད་འགྲོ་བ་ནི་ཧ་ཅང་མགྱོགས་ཤིང་། དགུན་དཔྱིད་དབྱར་བཅས་དུས་ཚིགས་གསུམ་ཡུད་ཙམ་ཞིག་ལ་འདས་པ་དང་ད་ཆ་སྟོན་ཟླ་ཤར་ ,dus tshod 'gro ba ni ha cang mgyogs shing /_dgun dpyid dbyar bcas dus tshigs gsum yud tsam zhig la 'das pa dang da cha ston zla shar _,https://d38pmlk0v88drf.cloudfront.net/wav16k/STT_AB00239_0063_578984_to_585844.wav,STT_AB,2,108,6.86,wav16k/STT_AB00239_0063_578984_to_585844.wav,དུས་ཚོད་འགྲོ་བ་ནི་ཧ་ཅང་མགྱོགས་ཤིངདགོན་དཔྱིད་དབྱར་བཅས་དུས་ཚེས་གསུམ་ཡུད་ཙམ་ཞིག་ལ་བསྡད་པ་དང་། ད་ཆ་སྟོན་ཟླ་ཤ་
STT_AB00239_0064_585844_to_592704,པས་སྤང་རི་མཐོ་སར་གཡའ་མདངས་སེརརེ་འཚུབ་འཚུབ་བྱེད་པ་དང་རྒྱུགས་ཆུ་དག་ཀྱང་རིམ་བཞིན་དྭངས་གཙང་དུ་གྱུར།  ,pas spang ri mtho sar g.ya' mdangs serare 'tshub 'tshub byed pa dang rgyugs chu dag kyang rim bzhin dwangs gtsang du gyur/__,https://d38pmlk0v88drf.cloudfront.net/wav16k/STT_AB00239_0064_585844_to_592704.wav,STT_AB,2,97,6.86,wav16k/STT_AB00239_0064_585844_to_592704.wav,བས་སྤང་རི་མཐོ་སར་གཡང་མདངས་སེ་རི་འཚུབ་འཚུབ་བྱེད་པ་དང་རྒྱུག་ཆུ་དག་ཀྱང་རིམ་བཞིན་དྭངས་གཙང་དུ་གྱུར།
STT_AB00239_0075_693267_to_702619,འདེབས་རོགས་དང་འདེབས་སྟངས་ཀྱང་སློབ་རོགས་བྱེད་ལ་དེ་མིན་ལས་ཀ་གཞན་དག་ལ་ཡང་བསམ་པ་རྣམ་དག་གིས་རོགས་རམ་བྱེད་ཀྱི་ཡོད་པས་ཁོ་གཉིས་ཀྱིས་ཀྱང་སྤྱི་བོའི་རྩེ་རུ་བཀུར་གྱི་ཡོད།  ,'debs rogs dang 'debs stangs kyang slob rogs byed la de min las ka gzhan dag la yang bsam pa rnam dag gis rogs ram byed kyi yod pas kho gnyis kyis kyang spyi bo'i rtse ru bkur gyi yod/__,https://d38pmlk0v88drf.cloudfront.net/wav16k/STT_AB00239_0075_693267_to_702619.wav,STT_AB,2,160,9.352,wav16k/STT_AB00239_0075_693267_to_702619.wav,འདེབས་རོགས་དང་འདེབས་སྟངས་ཀྱང་སློབ་རོགས་བྱེད་ལ་དེ་མིན་ལས་ཀ་གཞན་དག་ལཡ་བསམ་པ་རྣམ་དག་གིས་རོགས་རམ་བྱེད་ཀྱི་ཡོད་པས་ཁོ་གཉིས་ཀྱིས་ཀྱང་སྤྱི་བོའི་རྩི་རུ་བསྐུར་གྱི་ཡོད།
STT_AB00322_1058_5734069_to_5742943,བརྣབ་སེམས་དང་ལོག་ལྟ་ལྡན་པས་ཡོད་ཀྱི། མངོན་གྱུར་དུ་མེད་དེ། ཆགས་བྱའི་རྫས་མེད་ཅིང་། ལས་འབྲས་མངོན་དུ་གྱུར་པའི་ཕྱིར། སྲོག་གཅོད་མེད་ ,brnab sems dang log lta ldan pas yod kyi/_mngon gyur du med de/_chags bya'i rdzas med cing /_las 'bras mngon du gyur pa'i phyir/_srog gcod med _,https://d38pmlk0v88drf.cloudfront.net/wav16k/STT_AB00322_1058_5734069_to_5742943.wav,STT_AB,2,126,8.874,wav16k/STT_AB00322_1058_5734069_to_5742943.wav,བརྣབ་སེམས་དང་ལོག་ལྟ་ལྡན་པས་ཡོད་ཀྱི་མངོན་གྱུར་དུ་མེད་དེ། ཆགས་བྱའི་རྫས་མེད་ཅིང་། ལས་འབྲས་མངོན་དུ་གྱུར་པའི་ཕྱིར། སྲོག་གཅོད་མེད་
STT_AB00239_0060_551390_to_560230,དེ་ནས་བཟུང་དོན་གྲུབ་ནི་ད་ལྟའི་སྨྲ་བ་ཉུང་ཞིང་བློ་སྦུག་དོག་ལ་ག་དུས་ཡིན་ནའང་སེམས་སྡུག་ཆེན་པོ་ཞིག་གིས། མནན་ནས་ཡོད་པའི་མི་ཞིག་ཏུ་གྱུར།  ,de nas bzung don grub ni da lta'i smra ba nyung zhing blo sbug dog la ga dus yin na'ang sems sdug chen po zhig gis/_mnan nas yod pa'i mi zhig tu gyur/__,https://d38pmlk0v88drf.cloudfront.net/wav16k/STT_AB00239_0060_551390_to_560230.wav,STT_AB,2,131,8.84,wav16k/STT_AB00239_0060_551390_to_560230.wav,དེ་ནས་བཟུང་དོན་གྲུབ་ནི་ད་ལྟའི་སྨྲ་བ་ཉུང་ཞིང་བློ་ཕུག་དོག་ལ་ག་དུས་ཡིན་ནའང་སེམས་སྡུག་ཆེན་པོ་ཞིག་གིས་མནན་ནས་ཡོད་པའི་མི་ཞིག་ཏུ་གྱུར།
STT_AB00239_0066_605213_to_614752,ས་ཞིང་ནང་གི་ལོ་ཏོག་སྔ་བཏབ་ཁག་གཅིག་སེར་ཐིང་ཐིང་དུ་གྱུར་ཡོད་པ་དང་ཕྱི་བཏབ་རྣམས་ཀྱང་རིམ་བཞིན་ཚོས་གཞི་འགྱུར་འགྲོ་ཡི་ཡོད་པས་དངོས་གནས་སྟོནགྱི་ཉམས་འགྱུར་ཆེན་པོ་མངོན་ཡོང་།  ,sa zhing nang gi lo tog snga btab khag gcig ser thing thing du gyur yod pa dang phyi btab rnams kyang rim bzhin tshos gzhi 'gyur 'gro yi yod pas dngos gnas stonagyi nyams 'gyur chen po mngon yong /__,https://d38pmlk0v88drf.cloudfront.net/wav16k/STT_AB00239_0066_605213_to_614752.wav,STT_AB,2,164,9.539,wav16k/STT_AB00239_0066_605213_to_614752.wav,ས་གཞིའི་ནང་གི་ལོ་ཏོག་སྔ་ཐབ་ཁག་ཅིག་གསེར་ཐིང་ཐིང་དུ་གྱུར་ཡོད་པ་དང་ྱི་ཐབ་རྣམས་ཀྱང་རིམ་བཞིན་ཚོས་གཞིར་འགྱུར་འགྲོ་གི་ཡོད་པས་དངོས་གནས་སྟོན་གྱི་ཉམས་འགྱུར་ཆེན་པོ་མངོན་ཡོང་།
STT_AB00239_0059_539223_to_551203,དེ་ནས་རྒྱུན་བཞུགས་པ་དགེ་འདུན་གཉིས་གདན་དྲངས་ནས་སྐུ་ཕུང་ཉིན་གསུམ་བཞག་ཐོག་སྔོ་སྨོན་རིམ་གྲོ་སོགས་རྗེས་མཇུག་གི་བྱ་བ་རྣམས་ལེགས་པར་སྒྲུབ་པ་དང་མཐར་རྟོགས་ལྡན་སྐད་བཏང་ནས་བྱ་གཏོར་བྱེད།  ,de nas rgyun bzhugs pa dge 'dun gnyis gdan drangs nas sku phung nyin gsum bzhag thog sngo smon rim gro sogs rjes mjug gi bya ba rnams legs par sgrub pa dang mthar rtogs ldan skad btang nas bya gtor byed/__,https://d38pmlk0v88drf.cloudfront.net/wav16k/STT_AB00239_0059_539223_to_551203.wav,STT_AB,2,175,11.98,wav16k/STT_AB00239_0059_539223_to_551203.wav,དེ་ནས་རྒྱུན་བཞུགས་པ་དགེ་འདུན་གཉིས་གདན་དྲངས་ནས་སྐུ་ཕུང་ཉིན་གསུམ་བཞག་ཐོག་སྔོ་མོའ་རིམ་གྲོ་སོགས་རྗེས་འཇུག་གི་བྱ་བ་རྣམས་ལེགས་པར་བསྒྲུབ་པ་དང་།མཐར་སྟོབས་ལྡན་སྐད་བཏང་ནས་ཇ་དོར་བྱས།
STT_AB00239_0073_676493_to_683182,གྲོང་ཚོའི་ནང་དུ་ཁོང་གཉིས་ལ་སྤུན་ཉེ་འགའ་ཞིག་ཡོད་ནའང་བདེ་སྒྲོན་གྱི་གཅུང་པོ་ཞིག་ཡོད་པ་དེའི་མིང་ལ་ཟླ་བ་ཟེར་བ་དང་།  ,grong tsho'i nang du khong gnyis la spun nye 'ga' zhig yod na'ang bde sgron gyi gcung po zhig yod pa de'i ming la zla ba zer ba dang /__,https://d38pmlk0v88drf.cloudfront.net/wav16k/STT_AB00239_0073_676493_to_683182.wav,STT_AB,2,111,6.689,wav16k/STT_AB00239_0073_676493_to_683182.wav,གྲོང་ཚོའི་ནང་དུ་ཁོ་གཉིས་ལ་སྤུན་ཉེ་འགའ་ཞིག་ཡོད་ན་ཡང་བདེ་སྒྲོན་གྱིས་གཅུང་པོ་ཞིག་ཡོད་པ་དེའི་མིང་ལ་ཟླ་བ་ཟེར་བ་དང་།
STT_AB00239_0074_683916_to_693267,རྣམ་ཀུན་ཁོ་གཉིས་ཀྱི་འཚོ་བའི་གྲོས་འདྲི་ས་དང་བློ་གཏད་བཅོལ་ཡུལ་ཡིན་པས་ཁོ་གཉིས་ཀྱི་སར་ཡང་ཡང་འགྲོ་བ་དང་དོན་གྲུབ་ཀྱིས་ས་ཞིང་འདེབས་ལས་མ་ཤེས་གོང་ས་ཞིང་ ,rnam kun kho gnyis kyi 'tsho ba'i gros 'dri sa dang blo gtad bcol yul yin pas kho gnyis kyi sar yang yang 'gro ba dang don grub kyis sa zhing 'debs las ma shes gong sa zhing _,https://d38pmlk0v88drf.cloudfront.net/wav16k/STT_AB00239_0074_683916_to_693267.wav,STT_AB,2,144,9.351,wav16k/STT_AB00239_0074_683916_to_693267.wav,རྣམ་ཀུན་ཁོ་གཉིས་ཀྱི་འཚོ་བའི་དྲོས་འབྲི་ས་དང་བློ་གཏད་གཅོད་ཡུལ་ཡིན་པས་ཁོ་གཉིས་ཀྱི་སར་ཡང་ཡང་འགྲོག་པ་དང་དོན་གྲུབ་ཀྱིས་ས་ཞིང་ལྡེབས་ལས་མ་ཤེས་གོང་ས་ཞིང་
STT_AB00319_0468_1123250_to_1124598,འཁོར་དང་བཅས་ན།  ,'khor dang bcas na/__,https://d38pmlk0v88drf.cloudfront.net/wav16k/STT_AB00319_0468_1123250_to_1124598.wav,STT_AB,2,16,1.348,wav16k/STT_AB00319_0468_1123250_to_1124598.wav,འདོར་དང་བཅས་ན་
