file_name,uni,wylie,url,dept,grade,char_len,audio_len,path,inf
STT_AB00227_0035_411794_to_423182,བཏང་བ་ལྟར་སྨྲས། བ་ལུའི་མེ་ཏོག་གིས་པད་ཁའི་མེ་ཏོག་སྨན་ཁང་གི་སྒོ་ཁ་བར་བསྐྱལ་རྗེས་རང་ཉིད་ཉེ་འགྲམ་གྱི་ཇ་ཁང་ཞིག་གི་ནང་ཨ་ཅག་གི་ནད་གཞིའི་བརྟག་དཔྱད་མཇུག་འབྲས་སྒུག་སྟེ་བསྡད།  ,btang ba ltar smras/_ba lu'i me tog gis pad kha'i me tog sman khang gi sgo kha bar bskyal rjes rang nyid nye 'gram gyi ja khang zhig gi nang a cag gi nad gzhi'i brtag dpyad mjug 'bras sgug ste bsdad/__,https://d38pmlk0v88drf.cloudfront.net/wav16k/STT_AB00227_0035_411794_to_423182.wav,STT_AB,2,165,11.388,wav16k/STT_AB00227_0035_411794_to_423182.wav,བཏང་བ་ལྟར་སྨྲས། བ་ལུའི་མེ་ཏོག་གིས་པད་ཁའི་མེ་ཏོག་སྨན་ཁང་གི་སྒོ་ཁ་བར་བསྐྱལ་རྗེས་རང་ཉིད་ཉེ་འགྲམ་གྱི་ཇ་ཁང་ཞིག་གི་ནང་ཨ་ཅག་གིས་ནད་གཞིའི་བརྟག་དཔྱད་མཇུག་འབྲས་སྒུག་སྟེ་བསྡད།
STT_AB00227_0036_426544_to_439288,སྨན་ཁང་ནི་དེ་སྔོན་གྱི་སྨན་ཁང་དེ་རང་ཡིན་ལ། ཨེམ་རྗེ་ཡང་སྔར་མེ་ཏོག་དང་རྨི་ལས། ང་དང་ང་བཞིན་སྔོན་གྱི་ཨེམ་རྗེ་དེ་རང་ཡིན། པད་ཁའི་མེ་ཏོག་སྨན་ཁང་གི་བར་ཁྱམས་ནང་ཡུན་རིང་སྒུག་རྗེས་གཞི་ནས་སྨན་གཡོག་གིས་པད་ཁའི་མེ་ཏོག་གི་མིང་འབོད་པས།  ,sman khang ni de sngon gyi sman khang de rang yin la/_em rje yang sngar me tog dang rmi las/_nga dang nga bzhin sngon gyi em rje de rang yin/_pad kha'i me tog sman khang gi bar khyams nang yun ring sgug rjes gzhi nas sman g.yog gis pad kha'i me tog gi ming 'bod pas/__,https://d38pmlk0v88drf.cloudfront.net/wav16k/STT_AB00227_0036_426544_to_439288.wav,STT_AB,2,219,12.744,wav16k/STT_AB00227_0036_426544_to_439288.wav,སྨན་ཁང་ནི་དེ་སྔོན་གྱི་སྨན་ཁང་དེ་རང་ཡིན་ལ། ཨེམ་རྗེ་ཡང་སྔར་གྱི་ཨེམ་རྗེ་ད་ག་རང་ཡིན། པད་ཁའི་མེ་ཏོག་སྨན་ཁང་གི་བར་ཁྱམས་ནང་ཡུན་རིང་སྒུག་རྗེས། གཞི་ནས་སྨན་གཡོག་གི་པད་ཁའི་མེ་ཏོག་གི་མིང་འབོད་པས།
STT_AB00227_0038_452033_to_464778,མོའི་སྐད་ཆ་དེ་ཨེམ་རྗེ་དེས་མ་གོ་བའམ་ཡང་ན་འགྲེལ་བཤད་དེ་ལྟར་བྱེད་པ་ལྷག་མ་ལྟར་དུ་སྣང་བ་ཅི་ཡིན་མ་ཤེས་ཀྱང་ཨེམ་རྗེ་དེས་མོའི་སྐད་ཆར་སྣང་བ་ཙམ་ཡང་མ་བཏང་བར་སླར་ཡང་སྔོན་གྱི་ ,mo'i skad cha de em rje des ma go ba'am yang na 'grel bshad de ltar byed pa lhag ma ltar du snang ba ci yin ma shes kyang em rje des mo'i skad char snang ba tsam yang ma btang bar slar yang sngon gyi _,https://d38pmlk0v88drf.cloudfront.net/wav16k/STT_AB00227_0038_452033_to_464778.wav,STT_AB,2,162,12.745,wav16k/STT_AB00227_0038_452033_to_464778.wav,འམོའི་སྐད་ཆ་དེས་ཨེམ་རྗེ་དེས་མ་གོ་བའམ། ཡང་ན་འགྲེལ་བཤད་དེ་ལྟར་བྱེད་པ་ལྷག་མ་རྟར་ཏུ་སྣང་བ་ཅི་ཡིན་མ་ཤེས་ཀྱང་། ཨེམ་རྗེ་དེས་ཁོ་མོའི་སྐད་ཆར་སྣང་བ་ཙམ་ཡང་མ་བཏང་བར་སླར་ཡང་སྔོན་གྱི་
STT_AB00227_0039_464778_to_477522,ཤོག་ལྷེ་དེ་དང་གཅིག་པ་གཅིག་ཀྱང་ཞིག་བྲིས་ཏེ་ཁྲག་དང་། ཟག་ཆུ་བརྟག་དཔྱད་བྱེད་པར་བཏང་། དེ་ཉིན་ནད་པ་ཅུང་ཉུང་བས་མོའི་བརྟག་དཔྱད་ཀྱི་འབྲས་བུ་ཡང་མྱུར་དུ་ཐོན་ཏེ་སྨན་པར་སྤྲད།  ,shog lhe de dang gcig pa gcig kyang zhig bris te khrag dang /_zag chu brtag dpyad byed par btang /_de nyin nad pa cung nyung bas mo'i brtag dpyad kyi 'bras bu yang myur du thon te sman par sprad/__,https://d38pmlk0v88drf.cloudfront.net/wav16k/STT_AB00227_0039_464778_to_477522.wav,STT_AB,2,163,12.744,wav16k/STT_AB00227_0039_464778_to_477522.wav,ག་གཤོག་ལྷེ་འདི་དང་གཅིག་པ་གཅིག་རྐྱང་ཞིག་སྒྲེས་ཏེ་ཁྲག་དང་ཟག་ཆུ་བརྟག་དཔྱད་བྱེད་པར་དང་། དེ་ཉིན་ནད་པ་ཅུང་ཉུང་བས་མོའི་བརྟག་དཔྱད་ཀྱི་འབྲས་བུ་ཡང་མྱུར་དུ་ཐོན་ཏེ་སྨན་པར་སྤྲོས།
STT_AB00227_0041_490267_to_503011,གི་ནད་པ་མང་ཆེ་བ་སྨན་པས་བཤད་པར་ཡིད་ཆེས་མེད་པ་འདི་འདྲ་ག་རེ་ཡིན་ནམ། ན་ཚ་དེ་ལ་སྨན་གཞུང་དུ་རེག་དུག་གི་ནད་ཅེས་འབོད་ཀྱང་དེ་ལ་རིགས་མི་འདྲ་བཞི་ཙམ་ཡོད། ཁྱོད་ཀྱི་ནད་གཞི་དེ་རིམ་པ་གསུམ་པར་སླེབས།  ,gi nad pa mang che ba sman pas bshad par yid ches med pa 'di 'dra ga re yin nam/_na tsha de la sman gzhung du reg dug gi nad ces 'bod kyang de la rigs mi 'dra bzhi tsam yod/_khyod kyi nad gzhi de rim pa gsum par slebs/__,https://d38pmlk0v88drf.cloudfront.net/wav16k/STT_AB00227_0041_490267_to_503011.wav,STT_AB,2,183,12.744,wav16k/STT_AB00227_0041_490267_to_503011.wav,ང་གི་ནད་པ་མང་ཆེ་བ་སྨན་པས་བཤད་པར་ཡིད་ཆེས་མེད་པ་འདི་འདྲ་ག་རེ་ཡིན་ནམ། ན་ཚ་དེ་ལ་སྨན་གཞུང་དུ་རེག་དུག་གིས་ནད་ཅེས་འབོད་ཀྱང་དེ་ལ་རིགས་མི་འདྲ་བ་བཞི་ཙམ་ཡོད། ཁྱོད་ཀྱི་ནད་གཞི་དེ་རིམ་པ་གསུམ་པར་སླེབས།
STT_AB00227_0040_477522_to_490267,ཨེམ་རྗེས་བརྟག་དཔྱད་ཀྱི་འབྲས་བུའི་ཤོག་ལྷེ་དེར་ཞིབ་པར་བལྟ་གྱིན་བློ་ཕམ་གྱི་མགོ་བོ་འཕྲེད་དུ་གཡུག་སྟེརེད་འདུགངས་ཁྱོད་ལ་སྔ་ས་ནས་ན་ཚ་འདིའི་ཚབས་ཚེའི་རང་བཞིན་གསལ་པོར་བཤད་ཀྱང་། ཁྱོད་ཀྱིས་ངའི་ཁ་ལ་ཉན་མ་བྱུང་། དེང་སང་ ,em rjes brtag dpyad kyi 'bras bu'i shog lhe der zhib par blta gyin blo pham gyi mgo bo 'phred du g.yug stered 'dugangs khyod la snga sa nas na tsha 'di'i tshabs tshe'i rang bzhin gsal por bshad kyang /_khyod kyis nga'i kha la nyan ma byung /_deng sang _,https://d38pmlk0v88drf.cloudfront.net/wav16k/STT_AB00227_0040_477522_to_490267.wav,STT_AB,2,205,12.745,wav16k/STT_AB00227_0040_477522_to_490267.wav,ཨེམ་རྗེས་བརྟག་དཔྱད་ཀྱི་འབྲས་བུའི་གཤོག་ལྷེ་དེར་ཞིབ་པ་ལྟ་གིན་བློ་ཕམ་གྱི་མགོ་བོའ་འཁྲིད་དུ་གཡུག་སྟེ་རེད་ཤག ངས་ཁྱོད་ལ་སྔ་ས་ནས་ན་ཚ་འདིའི་ཚབས་ཆེའི་རང་བཞསིན་གསལ་པོར་བཤད་ཀྱང་ཁྱོད་ཀྱིས་ངའི་ཁ་ལ་ཉན་མ་བྱུང་། དེང་སབ་
STT_AB00227_0044_528501_to_541245,དངུལ་མེད། ཡིན་ནའང་ངའི་ནད་གཞི་མགྱོགས་མྱུར་མ་དྲག་ན་མི་འགྲིགཅེས་འདར་སྐད་དང་བཅས་ཏེ་བཤད་པས་ཨེམ་རྗེ་བུ་མོ་དེས་མོའི་ལུས་ཐོག་གི་བབ་ཆགས་ལ་སྤུས་དག་པའི་གྱོན་པ་དང་། འདྲ་ཆགས་པའི་བཞིན་གྱི་ ,dngul med/_yin na'ang nga'i nad gzhi mgyogs myur ma drag na mi 'grigaces 'dar skad dang bcas te bshad pas em rje bu mo des mo'i lus thog gi bab chags la spus dag pa'i gyon pa dang /_'dra chags pa'i bzhin gyi _,https://d38pmlk0v88drf.cloudfront.net/wav16k/STT_AB00227_0044_528501_to_541245.wav,STT_AB,2,175,12.744,wav16k/STT_AB00227_0044_528501_to_541245.wav,དངུལ་མེད། ཡིན་ན་ཡང་ངའི་ནད་གཞི་མགྱོགས་མྱོང་མ་དྲགས་ན་མིན་འགྲིག་ཅེས་བདར་སྐས་དང་བཅས་ཏེ་བཤད་པས། ཨེམ་རྗེ་བུ་མོ་དེས་ཁོ་མོའི་ལུས་ཐོག་གི་བབས་ཆགས་ལ་སྤུས་དག་པའི་གྱོན་པ་དང་འདྲ་ཆགས་པའི་ཞིང་གྱི་
STT_AB00227_0046_553990_to_566734,མི་ཡིན་ཡང་། མཚན་ལ་འདྲེ་དང་ཁྱད་མེད་པས་ང་ཚོའི་གྲས་ཀྱི་གྱོན་པ་དང་། བྱུག་རྫས་ལ་ཉིན་མཚན་གྱི་དབྱེ་བ་ཡོདཅེས་འགྲེལ་བཤད་བྱས། སྐད་ཆ་དེ་དག་གོ་བ་དང་ཨེམ་རྗེ་བུ་མོ་དེས་དབུགས་རིང་ཞིག་བཏང་སྟེ། མོའི་བཞིན་ལས་ ,mi yin yang /_mtshan la 'dre dang khyad med pas nga tsho'i gras kyi gyon pa dang /_byug rdzas la nyin mtshan gyi dbye ba yodaces 'grel bshad byas/_skad cha de dag go ba dang em rje bu mo des dbugs ring zhig btang ste/_mo'i bzhin las _,https://d38pmlk0v88drf.cloudfront.net/wav16k/STT_AB00227_0046_553990_to_566734.wav,STT_AB,2,191,12.744,wav16k/STT_AB00227_0046_553990_to_566734.wav,མི་ཡིན་ཡང་མཚན་ལ་འདྲི་དང་ཁྱད་མེད་པས་ང་ཚོའི་གྲས་ཀྱི་གྱོན་པ་དང་བྱུག་རཚད་ལ་ཉིན་མཚན་གྱི་དབྱེ་བ་ཡོད་ཅེས་འདྲི་བཤད་བྱས། སྐད་ཆ་དེ་དག་གོ་བ་དང་ཨེམ་རྗེ་བུ་མོ་དེས་དབུགས་རིང་ཞིག་བཏང་སྟེ་མོའི་གཞིན་
STT_AB00227_0049_592224_to_604968,ཀྱི་རེད། འོན་ཀྱང་། ཞེས་མིག་ཆུ་གཏོང་གིན་དེ་ལྟར་བཤད། ཨེམ་རྗེ་དེས་སྐད་ཆ་དེ་གོ་རྗེས་ཡུད་ཙམ་གང་ཡང་མ་བཤད་པར་བསྡད། དེ་རྗེས་མོའི་གདོང་ལས་སྙིང་རྗེའི་ཉམས་དེ་བས་ཤུགས་ཆེ་རུ་སོང་སྟེ།  ,kyi red/_'on kyang /_zhes mig chu gtong gin de ltar bshad/_em rje des skad cha de go rjes yud tsam gang yang ma bshad par bsdad/_de rjes mo'i gdong las snying rje'i nyams de bas shugs che ru song ste/__,https://d38pmlk0v88drf.cloudfront.net/wav16k/STT_AB00227_0049_592224_to_604968.wav,STT_AB,2,171,12.744,wav16k/STT_AB00227_0049_592224_to_604968.wav,་རེད། འོན་ཀྱང་ཞེས་མིག་ཆུ་གཏོང་གིན་དེ་ལྟར་བཤད། ཨེམ་རྗེ་དེས་སྐད་ཆ་དེ་གོ་རྗེས་ཡུད་ཙམ་གང་ཡང་མ་བཤད་པར་བསྡད། དེ་རྗེས་ཁོ་མོའི་གདོང་ལས་སྙིང་རྗེའི་ཉམས་དེ་བས་ཤུགས་ཆེ་རུ་སོང་སྟེ་
STT_AB00227_0050_604968_to_617713,ངག་འཇམ་པོསབུ་མོ། ངས་ཁྱོད་ལས་ཀ་ག་རེ་བྱེད་མིན་འདྲི་གི་མེད། ངས་ཁྱོད་ངའི་ནད་པ་ཞིག་ཡིན་པ་ལས་གཞན་གང་ཡང་ཤེས་འདོད་མི་འདུགཚེ་སྲོག་ལས་གལ་ཆེ་བ་ག་རེ་ཡོད། གློད་མ་གཏོང་། རེ་བ་ཕྲ་མོ་རྟ་རྔ་ཙམ་ ,ngag 'jam posabu mo/_ngas khyod las ka ga re byed min 'dri gi med/_ngas khyod nga'i nad pa zhig yin pa las gzhan gang yang shes 'dod mi 'dugatshe srog las gal che ba ga re yod/_glod ma gtong /_re ba phra mo rta rnga tsam _,https://d38pmlk0v88drf.cloudfront.net/wav16k/STT_AB00227_0050_604968_to_617713.wav,STT_AB,2,177,12.745,wav16k/STT_AB00227_0050_604968_to_617713.wav,ང་འཇམ་པོས། བུ་མོ། ངས་རང་ལས་ཀ་ག་རེ་བྱེད་མིན་འགྲིག་གི་མེད། རང་ངའི་ནད་པ་ཞིག་ཡིན་པ་ལས་གཞན་གང་ཡང་ཤེས་འདོད་མི་འདུག ཚེ་སྲོག་ལས་གལ་ཆེ་བ་ག་རེ་ཡོད། བློས་མ་གཏོང་། རེ་བ་ཕྲ་མོ་རྟ་སྔ་ཙམ་
STT_AB00227_0048_579479_to_592224,ནི་ཧ་ཅང་རྩ་ཆེན་པོ་རེདཅེས་བཤད། དེར་པད་ཁའི་མེ་ཏོག་གིས་འུ་ཐུག་ཐབས་ཟད་ཀྱི་རྣམ་འགྱུར་ཡ་ང་པོ་ཞིག་བསྟན་ཏེཨེམ་རྗེ་ལགས། དངུལ་ཚེ་སྲོག་མ་རེད། ཡིན་ནའང་དེས་མིའི་ཚེ་སྲོག་སྐྱོབ་ཐུབ།  ,ni ha cang rtsa chen po redaces bshad/_der pad kha'i me tog gis 'u thug thabs zad kyi rnam 'gyur ya nga po zhig bstan teem rje lags/_dngul tshe srog ma red/_yin na'ang des mi'i tshe srog skyob thub/__,https://d38pmlk0v88drf.cloudfront.net/wav16k/STT_AB00227_0048_579479_to_592224.wav,STT_AB,2,168,12.745,wav16k/STT_AB00227_0048_579479_to_592224.wav,ནི་ཧ་ཅང་རྩ་ཆེན་པོ་རེད་ཅེས་བཤད། དེར་པད་ཁའི་མེ་ཏོག་གིས་འུ་ཐུག་ཐབས་ཟས་ཀྱི་རྣམ་འགྱུར་ཡ་ང་པོ་ཞིག་བསྟན་རྗེས་ཨེམ་རྗེ་ལགས། དངུལ་ཚེ་སྲོག་མ་རེད། ཡིན་ནཡང་དེས་མིའི་ཚེ་སྲོག་སྐྱོབ་ཐུབ་
STT_AB00227_0051_617713_to_630457,ལས་མེད་ཀྱང་ང་ཚོས་དེ་དམ་དུ་བཟུང་རྒྱུ་རེདཅེས་སྨན་ཁང་ནང་སྡོད་རྒྱུའི་པ་སེ་བྲིས་ཏེ་མོའི་ལག་ཏུ་སྤྲད། པད་ཁའི་མེ་ཏོག་གིས་མིག་ཆུ་གཏོང་གིནགང་ལྟར་ཤི་རྒྱུ་རེད། སྨན་ཁང་ནང་བསྡད་དེ་སྨན་རིན།  ,las med kyang nga tshos de dam du bzung rgyu redaces sman khang nang sdod rgyu'i pa se bris te mo'i lag tu sprad/_pad kha'i me tog gis mig chu gtong ginagang ltar shi rgyu red/_sman khang nang bsdad de sman rin/__,https://d38pmlk0v88drf.cloudfront.net/wav16k/STT_AB00227_0051_617713_to_630457.wav,STT_AB,2,176,12.744,wav16k/STT_AB00227_0051_617713_to_630457.wav,ལས་མེད་ཀྱང་ང་ཚོས་འདི་དམ་དུ་བཟུང་རྒྱུ་རེད་ཅེས་སྨན་ཁང་ནང་སྡོད་རྒྱུའི་པ་ས་བྲིས་ཏེ་ཁོ་མོའི་ལག་ཏུ་སྤྲད། པད་ཁའི་མེ་ཏོག་གི་མིག་ཆུ་གཏོང་གིན་གང་ལྟར་ཤི་རྒྱུ་རེད། སྨན་ཁང་ནང་བསྡད་དེ་སྨན་རིན་
STT_AB00227_0055_668523_to_678609,ཨེམ་རྗེ་བུ་མོ་དེསདེ་དག་ནི་འཁྲུལ་སྣང་རེད། རང་གི་ན་ཚ་སྡུག་ཏུ་འགྲོ་བའི་རྟགས་རེད། དེར་བརྟེན་ངེས་པར་དུ་སྨན་ཁང་དུ་སྡོད་དགོསཞེས་སྨན་ཁང་དུ་སྡོད་དགོས་པའི་བཀའ་ཕབས།  ,em rje bu mo desade dag ni 'khrul snang red/_rang gi na tsha sdug tu 'gro ba'i rtags red/_der brten nges par du sman khang du sdod dgosazhes sman khang du sdod dgos pa'i bka' phabs/__,https://d38pmlk0v88drf.cloudfront.net/wav16k/STT_AB00227_0055_668523_to_678609.wav,STT_AB,2,155,10.086,wav16k/STT_AB00227_0055_668523_to_678609.wav,ཨེམ་རྗེའ་བུ་མོ་དེས་དེ་དག་ནི་འཁྲུལ་སྣང་རེད། རང་གི་ན་ཚ་སྡུག་ཏུ་འགྲོ་བའི་རྟགས་རེད། དེར་བརྟེན་ངེས་པར་དུ་སྨན་ཁང་དུ་སྡོད་དགོས་ཞེས་སྨན་ཁང་དུ་སྡོད་དགོས་པའི་བཀའ་ཕབ།
STT_AB00227_0056_682619_to_695074,གྲོང་གསེབ་ནས་ཡིན་ཅིང་། ཞིང་ལས་ཁོ་ནའི་ཡོང་འབབ་ཀྱིས་ནང་མི་ཚོ་ལྟོ་གོས་ཕྱིད་ཙམ་ལས་གཞན་གྱི་ཡོང་འབབ་གང་ཡང་མེད་པས་གྲོང་ཚའི་ནང་གི་ངལ་རྩོལ་ནུས་ཤུགས་ཡོད་པའི་གཞོན་སྐྱེས་ཕོ་མོ་མང་ཆེ་བ་སི་ཁྲོན་གྱི་ཞིང་ཁུལ་ནས་ ,grong gseb nas yin cing /_zhing las kho na'i yong 'bab kyis nang mi tsho lto gos phyid tsam las gzhan gyi yong 'bab gang yang med pas grong tsha'i nang gi ngal rtsol nus shugs yod pa'i gzhon skyes pho mo mang che ba si khron gyi zhing khul nas _,https://d38pmlk0v88drf.cloudfront.net/wav16k/STT_AB00227_0056_682619_to_695074.wav,STT_AB,2,196,12.455,wav16k/STT_AB00227_0056_682619_to_695074.wav,མནས་ཡིན་ཞིང་། ཞིང་ལས་ཁོ་ནའི་ཡོང་འབབ་ཀྱི་ནང་མི་ཚེ་ལྟོ་གོས་ཕྱེད་ཙམ་ལས་གཞན་གྱི་ཡོང་འབབ་གང་ཡང་མེད་པས། གྲོང་ཚོའི་ནང་གི་ངལ་རྩོལ་ནུས་ཞུགས་ཡོད་པའི་གཞོན་སྐྱེས་ཕོ་མོ་མང་ཆེ་བ་ཟི་ཁྲོན་གྱི་ཞིང་ཁུལ་ནས་
STT_AB00227_0058_707529_to_719984,ཡོང་འབབ་འཁྱེར་ཏེ་ཁང་པ་རྒྱག་པ་དང་། ཁྱིམ་ཆས་ཉོ་བ་སོགས་ཁྱིམ་གྱི་གནས་བབ་ལ་འགྱུར་བ་ཆེན་པོ་གཏོང་ཐུབ་ཀྱི་ཡོད། ཁོ་ཚོའི་རི་ཁུག་འདི་ནས་ལོ་རེ་ནས་ལོ་རེ་བཞིན་གཞོན་སྐྱེས་ཕོ་གསར་མོ་གསར་ཚོ་ཕྱི་ལ་ཡོང་འབབ་གསོག་པར་ ,yong 'bab 'khyer te khang pa rgyag pa dang /_khyim chas nyo ba sogs khyim gyi gnas bab la 'gyur ba chen po gtong thub kyi yod/_kho tsho'i ri khug 'di nas lo re nas lo re bzhin gzhon skyes pho gsar mo gsar tsho phyi la yong 'bab gsog par _,https://d38pmlk0v88drf.cloudfront.net/wav16k/STT_AB00227_0058_707529_to_719984.wav,STT_AB,2,196,12.455,wav16k/STT_AB00227_0058_707529_to_719984.wav,ཡོང་འབབ་ཁྱེར་ཏེ་ཁང་པ་རྒྱག་པ་དང་། ཁྱིམ་ཆས་ཉོ་བ་སོགས་ཁྱིམ་གྱི་གནས་བབ་ལ་འགྱུར་བ་ཆེན་པོ་གཏོང་ཐུབ་ཀྱི་ཡོད། ཁོ་ཚོའི་རེ་ཁུག་འདི་ནས་ལོ་རེ་ནས་ལོ་རེ་བཞིན་གཞོན་སྐྱེས་ཕོ་བསང་མོ་གསར་ཚུ་ཕྱི་ལ་ཡོང་འབབ་གསོག་པར་
STT_AB00319_3053_8719547_to_8722158,དྲུག་པ་ཡིད་ཤེས་མིན་པ་རྟེན་དབང་པོ་ལྔ་ལས་སྐྱེས་པའི་ ,drug pa yid shes min pa rten dbang po lnga las skyes pa'i _,https://d38pmlk0v88drf.cloudfront.net/wav16k/STT_AB00319_3053_8719547_to_8722158.wav,STT_AB,2,50,2.611,wav16k/STT_AB00319_3053_8719547_to_8722158.wav,ཡིད་ཤེས་མིན་པ་རྟེན་དབང་པོ་ལྔ་ལས་སྐྱེས་པའི་
STT_AB00227_0059_719984_to_732439,འགྲོ་མཁན་ཇེ་མང་དུ་སོང་བས་མཐར་གྲོང་ཚོའི་ནང་གསུམ། དྲུགདགུལས་ལྷག་གི་མེད། མོའི་ཕ་ཡུལ་གྱི་ས་ཞིང་གཤིན་ལ། ཆར་ཆུ་བཟང་བས་འབྲུ་རིགས་དང་། སྔོ་ཚལ་ཤིང་འབྲས་བཅས་འབེལ་ཡང་དེས་རང་ཁ་རང་གསོ་ཐུབ་ ,'gro mkhan je mang du song bas mthar grong tsho'i nang gsum/_drugadagulas lhag gi med/_mo'i pha yul gyi sa zhing gshin la/_char chu bzang bas 'bru rigs dang /_sngo tshal shing 'bras bcas 'bel yang des rang kha rang gso thub _,https://d38pmlk0v88drf.cloudfront.net/wav16k/STT_AB00227_0059_719984_to_732439.wav,STT_AB,2,176,12.455,wav16k/STT_AB00227_0059_719984_to_732439.wav,འགྲོ་མཁན་ཇེ་མང་དུ་སོང་བས་མཐར་གྲོང་ཚོའི་ནང་གསུམ་དྲུག་དགུ་ལས་ལྷག་གི་མེད། མོའི་ཕ་ཡུལ་ས་ཞིང་ཤན་ལ་ཆ་ཆུ་བཟང་བའི་འབྲུ་རིགས་དང་སྔོ་ཚལ་ཤིང་འབྲས་བཅས་འྤེལ་ཡང་། དེས་རང་ག་རང་གསོ་ཐུབ་
STT_AB00227_0060_732439_to_744893,ཙམ་ལས་མེད་པས། ས་ཞིང་ལ་བརྟེན་ཏེ་ཕྱུག་འགྱུར་བྱ་ཐབས་བྲལ། ཁྱིམ་ཚང་མང་ཆེ་བས་གོང་ཁེ་པོས་ས་ཞིང་ཕལ་ཆེ་བ་བོགས་མར་གཏོང་ས་ཡོད་ན་བོགས་མར་བཏང་། གཏོང་ས་མེད་ན་ས་ཞིང་རེངས་སུ་བཅུག་ངལ་རྩུལ་ ,tsam las med pas/_sa zhing la brten te phyug 'gyur bya thabs bral/_khyim tshang mang che bas gong khe pos sa zhing phal che ba bogs mar gtong sa yod na bogs mar btang /_gtong sa med na sa zhing rengs su bcug ngal rtsul _,https://d38pmlk0v88drf.cloudfront.net/wav16k/STT_AB00227_0060_732439_to_744893.wav,STT_AB,2,172,12.454,wav16k/STT_AB00227_0060_732439_to_744893.wav,ཙམ་ལས་མེད་པས་ས་ཞིང་ལ་བརྟེན་ཏེ་ཕྱུགས་སྒྱུར་བྱ་ཐབས་བྲལ། ཁྱིམ་ཚང་མང་ཆེ་བས་གོང་ཁེལ་པོས་ས་ཞིང་ཕལ་ཆེ་བ་བོག་མར་གཏོང་ས་ཡོད་ན་བོག་མར་གཏོང་། གཏོང་ས་མེད་ན་ས་ཞིང་རེངས་སུ་བཅུག ངལ་རྩོལ་
