file_name,uni,wylie,url,dept,grade,char_len,audio_len,path,inf
STT_AB00242_0056_366339_to_376706,དོན་གྲུབ་ལམ་ཐག་ཐུང་ཐུང་དེ་འདྲ་ཞིག་བགྲོད་རིང་སེམས་ནང་དུ་ཐེ་ཚོམ་དང་སྐྲག་སྣང་གི་ཀུན་རྟོགས་རི་མོ་ཅི་ཡང་འཆར་ཞིང་། ཁོའི་སེམས་ལ་དེ་སྔོན་ཕུན་ཚོགས་ཀྱི་པ་ཕ་རྡོ་རྗེ་ ,don grub lam thag thung thung de 'dra zhig bgrod ring sems nang du the tshom dang skrag snang gi kun rtogs ri mo ci yang 'char zhing /_kho'i sems la de sngon phun tshogs kyi pa pha rdo rje _,https://d38pmlk0v88drf.cloudfront.net/wav16k/STT_AB00242_0056_366339_to_376706.wav,STT_AB,2,155,10.367,wav16k/STT_AB00242_0056_366339_to_376706.wav,དོན་གྲུབ་ལམ་དངས་ཐུང་ཐུང་དེ་འདྲ་ཞིག་བརྗོད་རིང་སེམས་ནང་ཐེ་ཚོམ་དང་སྐྲག་སྣང་གི་ཀུན་རྟོག་རི་མོ་ཅི་ཡང་འཆར་ཞིང་། ཁོའི་སེམས་ལ་དེ་སྔོན་ཕུན་ཚོགས་ཀྱི་པ་ཕ་རྡོ་རྗེ་
STT_AB00319_0433_1027892_to_1028592,རྩ་བ་ལས།  ,rtsa ba las/__,https://d38pmlk0v88drf.cloudfront.net/wav16k/STT_AB00319_0433_1027892_to_1028592.wav,STT_AB,2,10,0.7,wav16k/STT_AB00319_0433_1027892_to_1028592.wav,རྩ་བ་ལས།
STT_AB00319_0438_1046373_to_1047790,རྩོམ་པར་དམ་བཅས་པ་ཆོས་ཅན།  ,rtsom par dam bcas pa chos can/__,https://d38pmlk0v88drf.cloudfront.net/wav16k/STT_AB00319_0438_1046373_to_1047790.wav,STT_AB,2,26,1.417,wav16k/STT_AB00319_0438_1046373_to_1047790.wav,རྩོམ་པ་དམ་བཅས་པ་ཆོས་ཅན།
STT_AB00242_0073_500401_to_503046,ཡུལ་དེའི་ཁྱིམ་ཚང་ཡག་སྡུག་ལ་མ་ལྟོས་པར་ ,yul de'i khyim tshang yag sdug la ma ltos par _,https://d38pmlk0v88drf.cloudfront.net/wav16k/STT_AB00242_0073_500401_to_503046.wav,STT_AB,2,38,2.645,wav16k/STT_AB00242_0073_500401_to_503046.wav,ཡུལ་དེའི་ཁྱིམ་ཚང་ཡག་སྡུག་ལ་མ་ལྟོས་པར་
STT_AB00242_0064_427465_to_439223,ཁྱོད་རང་ནི་དལ་དུས་ལྷ་མི་གསོལ་བར་འགག་སར་ཐུག་དུས་ལྷ་འབོད་འདྲེ་འབོད་བྱེད་མཁན་ཞིག་རེད་ཤག ཆུ་དང་གད་པ་མཐོ་དམའ་རེས་མོས་ཡིན་པ་ཁྱེད་རང་གིས་ཤེས་ཀྱི་མ་རེད་པེ། ཡིན་ནས་ལས་ད་ནི་ནམ་ལངས་པ་དང་འདྲ་ ,khyod rang ni dal dus lha mi gsol bar 'gag sar thug dus lha 'bod 'dre 'bod byed mkhan zhig red shag_chu dang gad pa mtho dma' res mos yin pa khyed rang gis shes kyi ma red pe/_yin nas las da ni nam langs pa dang 'dra _,https://d38pmlk0v88drf.cloudfront.net/wav16k/STT_AB00242_0064_427465_to_439223.wav,STT_AB,2,180,11.758,wav16k/STT_AB00242_0064_427465_to_439223.wav,ཁྱེད་རང་ནི་དེ་དུས་ལྷག་མ་འཚོལ་པར་འགག་རྩར་ཐུག་དུས་ལྷ་འབོད་འདྲེལ་འྤོད་བྱེད་མཁན་ཞིག་རེད་ཤག ཆུ་དང་མཁས་པ་མཐོ་དམའ་རེས་མོས་ཡིན་པ་ཁྱེད་རང་གིས་ཤིས་ཀྱི་མ་རེད་པེ། ཡིན་ནས་ལས་ད་ནི་ནམ་ལངས་པ་འདྲ་འདྲ་
STT_AB00242_0065_439223_to_450981,ལ་ཡ་སྦུད་པ་གཡར་གཏོང་ཁག་པོ་རེད། ཅེས་པའི་སྐད་སྒྲ་ཞིག་ཀྱང་ཁོའི་རྣ་ལམ་དུ་གྲགས་པའི་སྣང་བ་བྱུང་ལ་སྐད་སྒྲ་དེ་ནི་བྲག་ཅ་འཁོར་བ་བཞིན་ཡང་ཡང་གྲགས་ཡོང་། སྐབས་དེར་མི་རིང་བའི་ས་ནས་ ,la ya sbud pa g.yar gtong khag po red/_ces pa'i skad sgra zhig kyang kho'i rna lam du grags pa'i snang ba byung la skad sgra de ni brag ca 'khor ba bzhin yang yang grags yong /_skabs der mi ring ba'i sa nas _,https://d38pmlk0v88drf.cloudfront.net/wav16k/STT_AB00242_0065_439223_to_450981.wav,STT_AB,2,166,11.758,wav16k/STT_AB00242_0065_439223_to_450981.wav,ད་ཡ་འབུད་པ་གཡར་མཁན་ཁག་པོ་རེད་ཅེས་པའི་སྐད་སྒྲ་ཞིག་ཀྱང་ཁོ་བོའི་རྣགས་ལམ་དུ་གྲགས་པའི་སྣང་བ་བྱུང་ལ་ སྐད་སྒྲ་དེ་ནི་དྲག་ཆ་འཁོར་བ་བཞིན་ཡང་ཡང་གྲགས་ཡོང་། སྐབས་དེར་མི་རིང་བའི་ས་ནས་
STT_AB00242_0069_476766_to_481715,རྡོ་རྗེའི་ཁྱིམ་ཚང་ནི་ཆ་རྐྱེན་དེ་ཙམ་མེད་པ་ཞིག་ཡིན་པས་གྲལ་རིམ་དབུལ་ཕོངས་ཞིག་ཡིན་ཞིང་།  ,rdo rje'i khyim tshang ni cha rkyen de tsam med pa zhig yin pas gral rim dbul phongs zhig yin zhing /__,https://d38pmlk0v88drf.cloudfront.net/wav16k/STT_AB00242_0069_476766_to_481715.wav,STT_AB,2,85,4.949,wav16k/STT_AB00242_0069_476766_to_481715.wav,རྡོ་རྗེའི་ཁྱིམ་ཚང་ཉིན་ཆ་རྐྱེན་དེ་ཙམ་མེད་པ་ཞིག་ཡིན་པས་བྲེལ་རི་དབུལ་ཕོངས་ཤིག་ཡིན་ཞིང་།
STT_AB00242_0071_485742_to_492943,སྒོ་ར་ཆུང་ཆུང་ཞིག་ཡོད་པ་དེའི་གཡས་ངོས་སུ་བ་ཚང་དང་དབུས་ངོས་སུ་མི་སྡོད་སའི་ཁང་པ་དང་མཛོད་ཁང་ཡོད་པ་ལས་ ,sgo ra chung chung zhig yod pa de'i g.yas ngos su ba tshang dang dbus ngos su mi sdod sa'i khang pa dang mdzod khang yod pa las _,https://d38pmlk0v88drf.cloudfront.net/wav16k/STT_AB00242_0071_485742_to_492943.wav,STT_AB,2,98,7.201,wav16k/STT_AB00242_0071_485742_to_492943.wav,སྒོ་ར་ཆུང་ཆུང་ཞིག་ཡོད་པ་དེའི་གཡས་ངོས་སུ་བ་ཚང་དང་དབུལ་ངོས་སུ་མི་སྡོད་སའི་ཁང་པ་དང་མཛོད་ཁང་ཡོད་པ་ལས་
STT_AB00242_0072_494564_to_499360,ཐོག་བརྩེགས་མ་ཡིན་པས་འཁྲིས་ཀྱི་ཁྱིམ་ཚང་ཉིས་ཐོག་དེའི་འཁྲིས་སུ་མངོན་ཆུང་ཆུང་ཞིག་ལས་མེད།  ,thog brtsegs ma yin pas 'khris kyi khyim tshang nyis thog de'i 'khris su mngon chung chung zhig las med/__,https://d38pmlk0v88drf.cloudfront.net/wav16k/STT_AB00242_0072_494564_to_499360.wav,STT_AB,2,86,4.796,wav16k/STT_AB00242_0072_494564_to_499360.wav,ཐོག་བརྩེགས་མ་ཡིན་པས་འཁྲིས་ཀྱི་ཁྱིམ་ཚང་ཉིས་ཐོག་དེའི་འཁྲིས་སུ་སྔོན་ཆུང་ཆུང་ཞིག་ལས་མེད།
STT_AB00558_0119_507448_to_510383,ཐལ་བ་མི་འཇུག་པ་འབའ་ཞིག་ཏུ་མ་ཟད་ཀྱི་ ,thal ba mi 'jug pa 'ba' zhig tu ma zad kyi _,https://d38pmlk0v88drf.cloudfront.net/wav16k/STT_AB00558_0119_507448_to_510383.wav,STT_AB,2,36,2.935,wav16k/STT_AB00558_0119_507448_to_510383.wav,ཐལ་བ་མི་འཇུག་པ་འབའ་ཞིག་ཏུ་མ་ཟད་ཀྱི།
STT_AB00242_0053_341877_to_348626,ཆུ་མིག་དེ་དག་ལ་འཁྱགས་པ་བརྒྱབ་མེད་པས་དབྱར་ཁ་སྐྱེས་པའི་བེའུ་དམར་ཁྲ་ཞིག་གིས་ ,chu mig de dag la 'khyags pa brgyab med pas dbyar kha skyes pa'i be'u dmar khra zhig gis _,https://d38pmlk0v88drf.cloudfront.net/wav16k/STT_AB00242_0053_341877_to_348626.wav,STT_AB,2,74,6.749,wav16k/STT_AB00242_0053_341877_to_348626.wav,ཡང་ཆུ་མིག་དེ་རང་ལ་འཁྱགས་པ་བརྒྱབ་མེད་པས་དབྱར་ཁ་སྐྱེས་པའི་བེའུ་དམར་ཁྲ་ཁྲ་ཞིག་གིས་
STT_AB00242_0055_357440_to_365554,ཁྱིམ་ཚང་ཁ་ཤས་ཉིས་ཐོག་ཡིན་ལ་ཁ་ཤས་ནི་གཅིག་ཐོག་ཡིན་པས་གཅིག་ཐོག་དེ་དག་ནི་རྒྱང་ནས་བལྟས་ན་ཧ་ཅང་ཉམས་དམའ་བར་སྣང་།  ,khyim tshang kha shas nyis thog yin la kha shas ni gcig thog yin pas gcig thog de dag ni rgyang nas bltas na ha cang nyams dma' bar snang /__,https://d38pmlk0v88drf.cloudfront.net/wav16k/STT_AB00242_0055_357440_to_365554.wav,STT_AB,2,107,8.114,wav16k/STT_AB00242_0055_357440_to_365554.wav,དང་ཁྱིམ་ཚང་ཁ་ཤས་ཉིས་རཐོགས་ཡིན་ལ་ཁ་ཤས་ནི་གཅིག་ཐོག་ཡིན་པས་གཅིག་ཐོག་དེ་དག་ནི་རྒྱང་ནས་བལྟས་ན་ཧ་ཅང་ཉམས་དམའ་བར་སྣང་།
STT_AB00242_0050_314394_to_324411,གི་མུ་ཁར་རམ་པ་སྔོག་བཞིན་ཡོད། གཡས་གཡོན་གྱི་གྲོང་པ་དེ་དག་འཇམ་ཐིང་ངེར་གནས་པ་དང་ཁྱིམ་ཚང་ཞིག་གི་ཐོག་ཁའི་སྟེང་ནས་བུད་མེད་གཉིས་ཀྱིས་དོན་གྲུབ་ལ་ལྟ་ཙམ་ ,gi mu khar ram pa sngog bzhin yod/_g.yas g.yon gyi grong pa de dag 'jam thing nger gnas pa dang khyim tshang zhig gi thog kha'i steng nas bud med gnyis kyis don grub la lta tsam _,https://d38pmlk0v88drf.cloudfront.net/wav16k/STT_AB00242_0050_314394_to_324411.wav,STT_AB,2,143,10.017,wav16k/STT_AB00242_0050_314394_to_324411.wav,གའི་མུ་གར་ར་མ་བསྔོག་བཞིན་ཡོད། གཡས་གཡོན་གྱི་གྲོང་པ་དེ་དག་འཇམ་ཐིང་ངེར་གནས་ཡོད་པ་དང་ཁྱིམ་ཚང་ཞིག་གི་ཐོག་ཁའི་སྟེང་ནས་བུད་མེད་གཉིས་ཀྱིས་དོན་གྲུབ་ལ་ལྟ་ཙམ་གྱི་
STT_AB00242_0051_324411_to_334428,གྱིས་སྐད་ཆ་ཤོད་བཞིན་ཡོད་པས་དོན་གྲུབ་ཀྱི་སེམས་ལ་བུད་མེད་དེ་གཉིས་ཀྱིས་རང་ཉིད་ཀྱི་རྩིབ་མ་བཤེར་བཞིན་ཡོད་ངེས་རེད་སྙམ། ཞིང་ཁ་གཉིས་ཀྱི་ ,gyis skad cha shod bzhin yod pas don grub kyi sems la bud med de gnyis kyis rang nyid kyi rtsib ma bsher bzhin yod nges red snyam/_zhing kha gnyis kyi _,https://d38pmlk0v88drf.cloudfront.net/wav16k/STT_AB00242_0051_324411_to_334428.wav,STT_AB,2,129,10.017,wav16k/STT_AB00242_0051_324411_to_334428.wav,གི་སྐད་ཆ་ཤོད་བཞིན་ཡོད་པས་དོན་གྲུབ་ཀྱི་སེམས་ལ་བུད་མེད་དེ་ཉིད་ཀྱིས་རང་ཉིད་ཀྱི་རྩིག་མར་ཤེར་བཞིན་ཡོད་ངེས་རེད་སྙམ། ཞིང་ཁ་གཉིས་ཀྱི་
STT_AB00242_0052_335127_to_341877,འདུས་མདོར་ན་ཁ་རྒྱ་ཆུང་ཆུང་ཞིག་ཡོད་པ་དང་དེའི་མགོར་ཆུ་མིག་ཅིག་ཡོད་པའི་གཡས་གཡོན་དུ་འཁྱགས་པ་མཐུག་པོ་བརྒྱབ་ཡོད་ནའང་ ,'dus mdor na kha rgya chung chung zhig yod pa dang de'i mgor chu mig cig yod pa'i g.yas g.yon du 'khyags pa mthug po brgyab yod na'ang _,https://d38pmlk0v88drf.cloudfront.net/wav16k/STT_AB00242_0052_335127_to_341877.wav,STT_AB,2,111,6.75,wav16k/STT_AB00242_0052_335127_to_341877.wav,མདུད་མཐོར་ན་ཁ་རྒྱ་ཆུང་ཆུང་ཞིག་ཡོད་པ་དང་། དེའི་སྐོར་ཆུ་མིག་ཅིག་ཡོད་པའི་གཡས་གཡོན་དུ་འཁྱག་པ་མཐུག་པོ་བརྒྱབ་ཡོད་ན་
STT_AB00242_0096_672278_to_679505,རྡོ་རྗེའི་སྐད་ཆ་དེ་དག་ལ་ཟུར་ཟའི་ནང་དོན་ཡོད་པས་དེ་མ་ཐག་དོན་གྲུབ་ཀྱི་སེམས་ནང་ལྗིད་ཏིག་གེར་ཕོག་སྟེ་བཞིན་མདོག་ལོག་པ་དང་ ,rdo rje'i skad cha de dag la zur za'i nang don yod pas de ma thag don grub kyi sems nang ljid tig ger phog ste bzhin mdog log pa dang _,https://d38pmlk0v88drf.cloudfront.net/wav16k/STT_AB00242_0096_672278_to_679505.wav,STT_AB,2,116,7.227,wav16k/STT_AB00242_0096_672278_to_679505.wav,རྡོ་རྗེའི་སྐད་ཆ་དེ་དག་ལ་ཟུར་ཟའི་ནང་དོན་ཡོད་པས་དེ་མ་ཐག་དོན་གྲུབ་ཀྱི་སེམས་ནང་ལྗིད་ྟིག་གིར་ཕོག་སྟེ་བཞིན་མདོག་ལོག་པ་དང་
STT_AB00319_0444_1059769_to_1061390,མཚན་གྱི་དོན་བཤད་པ་ལ་གཉིས།  ,mtshan gyi don bshad pa la gnyis/__,https://d38pmlk0v88drf.cloudfront.net/wav16k/STT_AB00319_0444_1059769_to_1061390.wav,STT_AB,2,27,1.621,wav16k/STT_AB00319_0444_1059769_to_1061390.wav,མཚན་གྱི་དོན་བཤད་པ་ལ་གཉིས།
STT_AB00319_0443_1058165_to_1059411,སྤྲོ་བ་སྔོན་དུ་བཏང་ནས་ ,spro ba sngon du btang nas _,https://d38pmlk0v88drf.cloudfront.net/wav16k/STT_AB00319_0443_1058165_to_1059411.wav,STT_AB,2,23,1.246,wav16k/STT_AB00319_0443_1058165_to_1059411.wav,སྤྲོ་བ་སྔོན་དུ་བཏང་ནས་
STT_AB00242_0077_534829_to_544923,མེ་ཕོར་དང་ཁོག་ཏིར་བཞག་ཡོད་པ་དེ་སྣུམ་ཐིང་ཐིང་ཕྱིས་ཡོད་པ་དང་མེ་ཕོར་ལས་དུ་བ་ཕྲ་པོ་ཞིག་སྔོ་ཕྱུར་ཕྱུར་དུ་ཐོན་བཞིན་ཡོད་པ་དེ་ནི་དངོས་གནས་དྲོ་སྐྱིད་ཀྱི་སྣང་བ་ལྡན་པ་ཞིག་རེད།  ,me phor dang khog tir bzhag yod pa de snum thing thing phyis yod pa dang me phor las du ba phra po zhig sngo phyur phyur du thon bzhin yod pa de ni dngos gnas dro skyid kyi snang ba ldan pa zhig red/__,https://d38pmlk0v88drf.cloudfront.net/wav16k/STT_AB00242_0077_534829_to_544923.wav,STT_AB,2,166,10.094,wav16k/STT_AB00242_0077_534829_to_544923.wav,མེ་འབོར་དང་ཁོག་ལཐིར་བཞག་ཡོད་པ་དེ་སྣུམ་ཐིང་ཐིང་ཕྱི་ཡོད་པ་དང་མེ་འབོར་ལས་དུ་བ་ཕྲ་མོ་ཞིག་སྔོ་ཆུར་ཕྱོར་དུ་ཐོན་བཞིན་ཡོད་པ་དེ་ནི་དངོས་གནས་དྲོ་སྐྱིད་ཀྱི་སྣང་བ་ལྡན་པ་ཞིག་རེད།
STT_AB00242_0100_700059_to_702209,མ་གཞི་ནས་ང་ཧམ་པ་ཆེ་དྲག་སོང་།  ,ma gzhi nas nga ham pa che drag song /__,https://d38pmlk0v88drf.cloudfront.net/wav16k/STT_AB00242_0100_700059_to_702209.wav,STT_AB,2,30,2.15,wav16k/STT_AB00242_0100_700059_to_702209.wav,མ་གཞི་ནས་ང་ཧམ་པ་ཆེ་དྲགས་སོང་།
STT_AB00242_0082_576203_to_577414,དེའི་གཡས་ངོས་སུ་ ,de'i g.yas ngos su _,https://d38pmlk0v88drf.cloudfront.net/wav16k/STT_AB00242_0082_576203_to_577414.wav,STT_AB,2,17,1.211,wav16k/STT_AB00242_0082_576203_to_577414.wav,དེའི་གཡས་ངོས་སུ་
STT_AB00242_0083_578216_to_589718,བུ་མོ་རྒན་པ་བལ་བསེད་བཞིན་ཡོད་པ་དང་ཆུང་བ་དེ་ཡོས་ཟ་གིན་བསྡད་འདུག རྡོ་རྗེ་ཡང་རེ་ལྡེའི་སླེའུ་ཞིག་འཚེམས་བཞིན་ཡོད་ཅིང་ཁོ་ཚོས་སྤྱིར་བཏང་གི་སྐད་ཆ་ཤོད་བཞིན་ ,bu mo rgan pa bal bsed bzhin yod pa dang chung ba de yos za gin bsdad 'dug_rdo rje yang re lde'i sle'u zhig 'tshems bzhin yod cing kho tshos spyir btang gi skad cha shod bzhin _,https://d38pmlk0v88drf.cloudfront.net/wav16k/STT_AB00242_0083_578216_to_589718.wav,STT_AB,2,148,11.502,wav16k/STT_AB00242_0083_578216_to_589718.wav,བུང་མོ་རྒན་པ་བལ་སེ་བཞིན་ཡོད་པ་དང་ཆུང་བ་དེ་ཡོད་ཟ་གིན་བསྡད་འདུག རྡོ་རྗེའང་རི་ལྡེའི་ལླེའུ་ཞིག་འཚིམ་བཞིན་ཡོད་ཅིང་ཁོ་ཚོས་སྤྱིར་བཏང་གི་སྐད་ཆ་ཤོད་བཞིན་
STT_AB00242_0166_1137807_to_1144590,ངའི་མ་གཉིས་ཀྱིས་ཟེར་ན་ཕྲུ་གུ་ཚང་མ་ནང་ལ་བཞག་ན་ཡག་པོ་ཡོད་མ་རེད། སྔོན་ལ་འོག་མ་ཡ་མནའ་མ་གཅིག་ལེན་བྱེད་ ,nga'i ma gnyis kyis zer na phru gu tshang ma nang la bzhag na yag po yod ma red/_sngon la 'og ma ya mna' ma gcig len byed _,https://d38pmlk0v88drf.cloudfront.net/wav16k/STT_AB00242_0166_1137807_to_1144590.wav,STT_AB,2,98,6.783,wav16k/STT_AB00242_0166_1137807_to_1144590.wav,ངའི་ཕ་མ་གཉིས་ཀྱིས་ཟེར་ན་ཕྲུ་གུ་ཚང་མ་ནང་ལ་བཞག་ན་ཡག་པོ་ཡོད་མ་རེད། སྔོན་ལ་འོག་མ་ལ་ཡ་མནའ་མ་གཅིག་ལེན་བྱས་
STT_AB00242_0078_546271_to_554180,མེ་ཕོར་ཁོག་ཏིར་གྱི་འཁྲིས་སུ་གསོལ་ལྕོག་ཆུང་ཆུང་ཞིག་ཡོད་པ་དེའི་སྟེང་དུ་མདོག་འགྱུར་ནས་ནག་ཐིང་ཐིང་ཆགས་པའི་སྟོད་བླའི་ཇ་ཕོར་གྱི་ནང་ ,me phor khog tir gyi 'khris su gsol lcog chung chung zhig yod pa de'i steng du mdog 'gyur nas nag thing thing chags pa'i stod bla'i ja phor gyi nang _,https://d38pmlk0v88drf.cloudfront.net/wav16k/STT_AB00242_0078_546271_to_554180.wav,STT_AB,2,126,7.909,wav16k/STT_AB00242_0078_546271_to_554180.wav,མེ་འཕོར་ཁོ་ལཐིར་གྱི་འཁྲིས་སུ་གསོལ་ཇོག་ཆུང་ཆུང་ཞིག་ཡོད་པ་དེའི་སྟེང་དུ་མདོག་ྒྱུར་ནས་ནགས་ཐིང་ཐིང་ཆགས་པའི་སྟོད་ལྷའི་ཇ་ཕོར་གྱི་ནང་
STT_AB00242_0087_612585_to_614735,དུས་ཚོད་གང་འཚམས་སོང་རྗེས་དོན་གྲུབ་ཀྱིས་ ,dus tshod gang 'tshams song rjes don grub kyis _,https://d38pmlk0v88drf.cloudfront.net/wav16k/STT_AB00242_0087_612585_to_614735.wav,STT_AB,2,40,2.15,wav16k/STT_AB00242_0087_612585_to_614735.wav,དུས་ཚོད་གང་འཚམ་སོང་རྗེས་དོན་གྲུབ་ཀྱིས་
STT_AB00320_1529_6709923_to_6714394,འབྱུང་ལས་གྱུར་བའི་རྣམ་པ་ལྔ། འབྱུང་བས་འབྱུང་གྱུར་གྱི་སྐྱེ་བའི་རྒྱུ།  ,'byung las gyur ba'i rnam pa lnga/_'byung bas 'byung gyur gyi skye ba'i rgyu/__,https://d38pmlk0v88drf.cloudfront.net/wav16k/STT_AB00320_1529_6709923_to_6714394.wav,STT_AB,2,68,4.471,wav16k/STT_AB00320_1529_6709923_to_6714394.wav,འབྱུང་ལས་གྱུར་པའི་རྣམ་པ་ལྔ། འབྱུང་བས་འབྱུང་གྱུར་གྱི་སྐྱེ་བའི་རྒྱུ།
STT_AB00319_0449_1071680_to_1073387,རྗེས་འབྲང་གི་དོན་ལ་དཔྱད་པའོ།  ,rjes 'brang gi don la dpyad pa'o/__,https://d38pmlk0v88drf.cloudfront.net/wav16k/STT_AB00319_0449_1071680_to_1073387.wav,STT_AB,2,30,1.707,wav16k/STT_AB00319_0449_1071680_to_1073387.wav,རྗེས་འབྲང་གི་དོན་ལ་དཔྱད་པའོ།
STT_AB00319_0453_1083711_to_1084428,རྩ་བ་ལས།  ,rtsa ba las/__,https://d38pmlk0v88drf.cloudfront.net/wav16k/STT_AB00319_0453_1083711_to_1084428.wav,STT_AB,2,10,0.717,wav16k/STT_AB00319_0453_1083711_to_1084428.wav,རྩ་བ་ལས།
STT_AB00242_0095_664172_to_671168,ཐུགས་བསུན་ཞུ་རིན་ག་རེ་ཡོད་རེད། ང་ཚོ་དབུལ་པོའི་ཁྱིམ་ཚང་གིས་ཁྱེད་ཀྱི་རེ་བ་ག་བ་སྐོང་ཐུབ་ཀི་རེད་ཞེས་སྨྲས།  ,thugs bsun zhu rin ga re yod red/_nga tsho dbul po'i khyim tshang gis khyed kyi re ba ga ba skong thub ki red zhes smras/__,https://d38pmlk0v88drf.cloudfront.net/wav16k/STT_AB00242_0095_664172_to_671168.wav,STT_AB,2,103,6.996,wav16k/STT_AB00242_0095_664172_to_671168.wav,ཐུགས་སུན་ཞུ་རིན་ག་རེ་ཡོད་རེད། ང་ཚོ་དབུལ་པོའི་ཁྱིམ་ཚང་གིས་ཁྱེད་རང་གི་རེ་བ་ག་བར་སྐོང་ཐུབ་ཀྱི་རེད་ཞེས་སྨྲས།
STT_AB00242_0118_804991_to_805571,རྣམ་ཀུན་ ,rnam kun _,https://d38pmlk0v88drf.cloudfront.net/wav16k/STT_AB00242_0118_804991_to_805571.wav,STT_AB,2,9,0.58,wav16k/STT_AB00242_0118_804991_to_805571.wav,རྣམ་ཀུན་
STT_AB00242_0119_806100_to_807158,མ་ཎི་བགྲང་པ་ ,ma Ni bgrang pa _,https://d38pmlk0v88drf.cloudfront.net/wav16k/STT_AB00242_0119_806100_to_807158.wav,STT_AB,2,13,1.058,wav16k/STT_AB00242_0119_806100_to_807158.wav,མ་ཎི་བགྲངས་པ།
STT_AB00242_0120_807926_to_809172,ཁ་ན་རོགས་རེད་སྙམ་སྟེ་ ,kha na rogs red snyam ste _,https://d38pmlk0v88drf.cloudfront.net/wav16k/STT_AB00242_0120_807926_to_809172.wav,STT_AB,2,22,1.246,wav16k/STT_AB00242_0120_807926_to_809172.wav,ཁ་ན་རོགས་རེད་སྙམ་སྟེ་
STT_AB00242_0123_828899_to_830844,རྡོ་རྗེས་བསམ་བློ་ཡུན་རིང་མ་བཏང་བར་ ,rdo rjes bsam blo yun ring ma btang bar _,https://d38pmlk0v88drf.cloudfront.net/wav16k/STT_AB00242_0123_828899_to_830844.wav,STT_AB,2,35,1.945,wav16k/STT_AB00242_0123_828899_to_830844.wav,རྡོ་རྗེས་བསམ་བློ་ཡུན་རིང་མ་བཏང་བར་
STT_AB00242_0122_821919_to_828694,གོར་རྭ་འཁྱིལ་ལེར་ཡོད་པའི་འོད་ཀྱི་མདའ་མོ་དེས་རྡོ་རྗེའི་ལྐོག་འགྱུར་གྱི་རས་ཡོལ་ཚང་མ་བསྲེག་བཞིན་པ་ལྟར་སྣང་།  ,gor rwa 'khyil ler yod pa'i 'od kyi mda' mo des rdo rje'i lkog 'gyur gyi ras yol tshang ma bsreg bzhin pa ltar snang /__,https://d38pmlk0v88drf.cloudfront.net/wav16k/STT_AB00242_0122_821919_to_828694.wav,STT_AB,2,105,6.775,wav16k/STT_AB00242_0122_821919_to_828694.wav,གོར་ཁྱི་རིར་ཡོད་པའི་འོད་ཀྱི་བདག་མོ་དེས་རྡོ་རྗེའི་ལྐོག་གྱུར་གྱི་རས་ཡོལ་ཚང་མ་བསྲེགས་བཞིན་པ་ལྟར་སྣང་།
